Ziguinchor, Senegal: Ziguinchor Airport,N/A,N/A,N/A,N/A,N/A,N/A,N/A,N/A,N/A,N/A,N/A,N/A,N/A,N/A,N/A,N/A,
Owensboro, KY: Owensboro Daviess County,318.0,51324.549999999996,406.0,68765.39999999998,403.0,66227.62999999998,335.0,70824.33000000002,434.0,12934.860000000002,485.0,11354.289999999999,502.0,15114.980000000001,532.0,16146.490000000002,
Cape Rodney, Papua New Guinea: Cape Rodney Airport,N/A,N/A,N/A,N/A,N/A,N/A,N/A,N/A,N/A,N/A,N/A,N/A,N/A,N/A,N/A,N/A,
Thessaloniki, Greece: Makedonia,N/A,N/A,N/A,N/A,N/A,N/A,N/A,N/A,N/A,N/A,N/A,N/A,N/A,N/A,N/A,N/A,
Detroit, MI: Willow Run,N/A,N/A,N/A,N/A,N/A,N/A,N/A,N/A,N/A,N/A,N/A,N/A,N/A,N/A,N/A,N/A,
Carson City, NV: Carson,N/A,N/A,N/A,N/A,N/A,N/A,N/A,N/A,N/A,N/A,N/A,N/A,N/A,N/A,N/A,N/A,
Bethel, AK: Bethel Airport,739.0,36576.740000000005,629.0,39686.520000000004,672.0,70645.84999999999,766.0,44238.79000000001,1232.0,121536.38999999997,1366.0,154296.33000000002,1413.0,155406.80999999997,1547.0,146435.49999999997,
Stony Rapids, Canada: Stony Rapids Airport,N/A,N/A,N/A,N/A,N/A,N/A,N/A,N/A,N/A,N/A,N/A,N/A,N/A,N/A,N/A,N/A,
Coro, Venezuela: Jose Leonardo Chirinos,N/A,N/A,N/A,N/A,N/A,N/A,N/A,N/A,N/A,N/A,N/A,N/A,N/A,N/A,N/A,N/A,
Hyannis, MA: Barnstable Municipal-Boardman/Polando Field,141.0,30722.67000000001,353.0,63773.00000000001,753.0,125613.01,341.0,59904.320000000014,16.0,5799.85,126.0,19309.769999999997,640.0,69443.52,26.0,8599.87,
Maastricht, Netherlands: Maastricht Airport,N/A,N/A,N/A,N/A,N/A,N/A,N/A,N/A,N/A,N/A,N/A,N/A,N/A,N/A,N/A,N/A,
Jakobshavn, Greenland: Ilulissat,N/A,N/A,N/A,N/A,N/A,N/A,N/A,N/A,N/A,N/A,N/A,N/A,N/A,N/A,N/A,N/A,
Itaqui, Brazil: Itaqui Airport,N/A,N/A,N/A,N/A,N/A,N/A,N/A,N/A,N/A,N/A,N/A,N/A,N/A,N/A,N/A,N/A,
Arauquita, Colombia: Arauquita Airport,N/A,N/A,N/A,N/A,N/A,N/A,N/A,N/A,N/A,N/A,N/A,N/A,N/A,N/A,N/A,N/A,
Ljubljana, Slovenia: Ljubljana Airport,N/A,N/A,N/A,N/A,N/A,N/A,N/A,N/A,N/A,N/A,N/A,N/A,N/A,N/A,N/A,N/A,
Queens, AK: The Queens,N/A,N/A,N/A,N/A,N/A,N/A,N/A,N/A,N/A,N/A,N/A,N/A,N/A,N/A,N/A,N/A,
Fort George, Canada: Ft. George,N/A,N/A,N/A,N/A,N/A,N/A,N/A,N/A,N/A,N/A,N/A,N/A,N/A,N/A,N/A,N/A,
Tumut, Australia: Tumut Airport,N/A,N/A,N/A,N/A,N/A,N/A,N/A,N/A,N/A,N/A,N/A,N/A,N/A,N/A,N/A,N/A,
La Baule, France: Saint Nazaire/Montoir,N/A,N/A,N/A,N/A,N/A,N/A,N/A,N/A,N/A,N/A,N/A,N/A,N/A,N/A,N/A,N/A,
Carlsbad, CA: McClellan-Palomar,320.0,35365.84,341.0,47155.35000000003,274.0,48445.40999999999,377.0,53187.149999999994,958.0,225482.18000000005,66.0,14509.47,N/A,N/A,N/A,N/A,
Afton, WY: Afton Municipal,N/A,N/A,N/A,N/A,N/A,N/A,N/A,N/A,N/A,N/A,N/A,N/A,N/A,N/A,N/A,N/A,
Moses Point, AK: Moses Point Airport,N/A,N/A,N/A,N/A,N/A,N/A,N/A,N/A,N/A,N/A,N/A,N/A,N/A,N/A,N/A,N/A,
Arvidsjaur, Sweden: Arvidsjaur Airport,N/A,N/A,N/A,N/A,N/A,N/A,N/A,N/A,N/A,N/A,N/A,N/A,N/A,N/A,N/A,N/A,
Stockholm, Sweden: Arlanda,N/A,N/A,N/A,N/A,N/A,N/A,N/A,N/A,N/A,N/A,N/A,N/A,N/A,N/A,N/A,N/A,
Blackwater, Australia: Blackwater Airport,N/A,N/A,N/A,N/A,N/A,N/A,N/A,N/A,N/A,N/A,N/A,N/A,N/A,N/A,N/A,N/A,
Charlotte Amalie, VI: Cyril E King,10902.0,1292116.3399999999,10459.0,1179585.1300000008,9408.0,895696.9699999999,12607.0,1390876.4600000002,18429.0,4400517.069999999,17678.0,4198578.479999998,13387.0,3152578.7099999986,13857.0,3534532.550000002,
Vidalia, GA: Vidalia Regional,N/A,N/A,N/A,N/A,N/A,N/A,N/A,N/A,N/A,N/A,N/A,N/A,N/A,N/A,N/A,N/A,
Killeen, TX: Skylark Field,1020.0,191942.7500000001,1202.0,236323.03000000006,1239.0,229545.83999999997,1340.0,258627.13000000003,N/A,N/A,N/A,N/A,N/A,N/A,N/A,N/A,
Lakeland, FL: Lakeland Linder Regional,N/A,N/A,N/A,N/A,N/A,N/A,N/A,N/A,N/A,N/A,N/A,N/A,N/A,N/A,N/A,N/A,
Isle Royale Park, MI: Isle Royale National Park,N/A,N/A,N/A,N/A,N/A,N/A,N/A,N/A,N/A,N/A,N/A,N/A,N/A,N/A,N/A,N/A,
Bear Creek, AK: Bear Creek Airport,N/A,N/A,N/A,N/A,N/A,N/A,N/A,N/A,N/A,N/A,N/A,N/A,N/A,N/A,N/A,N/A,
Ronne, Denmark: Bornholm Ronne,N/A,N/A,N/A,N/A,N/A,N/A,N/A,N/A,N/A,N/A,N/A,N/A,N/A,N/A,N/A,N/A,
Dawson City, Canada: Dawson City Airport,N/A,N/A,N/A,N/A,N/A,N/A,N/A,N/A,N/A,N/A,N/A,N/A,N/A,N/A,N/A,N/A,
Tegucigalpa, Honduras: Toncontin International,N/A,N/A,N/A,N/A,N/A,N/A,N/A,N/A,N/A,N/A,N/A,N/A,N/A,N/A,N/A,N/A,
Whitebear, AK: Whitebear Airport,N/A,N/A,N/A,N/A,N/A,N/A,N/A,N/A,N/A,N/A,N/A,N/A,N/A,N/A,N/A,N/A,
Detroit, MI: Coleman A. Young Municipal,6658.0,18063.460000000003,9175.0,21658.970000000005,9140.0,19263.230000000003,N/A,N/A,N/A,N/A,N/A,N/A,N/A,N/A,N/A,N/A,
Deer Lake, Canada: Deer Lake Airport,N/A,N/A,N/A,N/A,N/A,N/A,N/A,N/A,N/A,N/A,N/A,N/A,N/A,N/A,N/A,N/A,
Payette, ID: Payette Municipal,N/A,N/A,N/A,N/A,N/A,N/A,N/A,N/A,N/A,N/A,N/A,N/A,N/A,N/A,N/A,N/A,
Navoi, Uzbekistan: Navoi Airport,N/A,N/A,N/A,N/A,N/A,N/A,N/A,N/A,N/A,N/A,N/A,N/A,N/A,N/A,N/A,N/A,
Conway, AR: Dennis F Cantrell Field,N/A,N/A,N/A,N/A,N/A,N/A,N/A,N/A,N/A,N/A,N/A,N/A,N/A,N/A,N/A,N/A,
Manzanita Lake, AK: Manzanita Lake Airport,N/A,N/A,N/A,N/A,N/A,N/A,N/A,N/A,N/A,N/A,N/A,N/A,N/A,N/A,N/A,N/A,
Kolwezi, Congo (Kinshasa): Kolwezi Airport,N/A,N/A,N/A,N/A,N/A,N/A,N/A,N/A,N/A,N/A,N/A,N/A,N/A,N/A,N/A,N/A,
Las Cruces, NM: Las Cruces International,3.0,1320.9699999999998,6.0,1644.79,8.0,2121.16,10.0,3462.93,N/A,N/A,N/A,N/A,N/A,N/A,N/A,N/A,
Gettysburg, PA: Gettysburg Regional,N/A,N/A,N/A,N/A,N/A,N/A,N/A,N/A,N/A,N/A,N/A,N/A,N/A,N/A,N/A,N/A,
Aiken, SC: Aiken Municipal,N/A,N/A,N/A,N/A,N/A,N/A,N/A,N/A,N/A,N/A,N/A,N/A,N/A,N/A,N/A,N/A,
Dover-Cheswold, DE: Delware Airpark,N/A,N/A,N/A,N/A,N/A,N/A,N/A,N/A,N/A,N/A,N/A,N/A,N/A,N/A,N/A,N/A,
Tauta, Papua New Guinea: Tauta Airport,N/A,N/A,N/A,N/A,N/A,N/A,N/A,N/A,N/A,N/A,N/A,N/A,N/A,N/A,N/A,N/A,
Buka Islands, Papua New Guinea: Buka,N/A,N/A,N/A,N/A,N/A,N/A,N/A,N/A,N/A,N/A,N/A,N/A,N/A,N/A,N/A,N/A,
Barra, United Kingdom: Barra Airport,N/A,N/A,N/A,N/A,N/A,N/A,N/A,N/A,N/A,N/A,N/A,N/A,N/A,N/A,N/A,N/A,
Jiyanklis, Egypt: Jiyanklis AB,N/A,N/A,N/A,N/A,N/A,N/A,N/A,N/A,N/A,N/A,N/A,N/A,N/A,N/A,N/A,N/A,
Okayama, Japan: Okayama Airport,N/A,N/A,N/A,N/A,N/A,N/A,N/A,N/A,N/A,N/A,N/A,N/A,N/A,N/A,N/A,N/A,
Tepic, Mexico: Tepic Airport,N/A,N/A,N/A,N/A,N/A,N/A,N/A,N/A,N/A,N/A,N/A,N/A,N/A,N/A,N/A,N/A,
Chelatna Lake Lodge, AK: Chelatna Lake Lodge Airport,N/A,N/A,N/A,N/A,N/A,N/A,N/A,N/A,N/A,N/A,N/A,N/A,N/A,N/A,N/A,N/A,
Napakiak, AK: Napakiak Airport,2.0,250.01,N/A,N/A,N/A,N/A,N/A,N/A,N/A,N/A,N/A,N/A,N/A,N/A,N/A,N/A,
Kozani, Greece: Filippos,N/A,N/A,N/A,N/A,N/A,N/A,N/A,N/A,N/A,N/A,N/A,N/A,N/A,N/A,N/A,N/A,
Rotterdam, Netherlands: Rotterdam Airport,N/A,N/A,N/A,N/A,N/A,N/A,N/A,N/A,N/A,N/A,N/A,N/A,N/A,N/A,N/A,N/A,
Funchal, Portugal: Madeira,N/A,N/A,N/A,N/A,N/A,N/A,N/A,N/A,N/A,N/A,N/A,N/A,N/A,N/A,N/A,N/A,
Fayetteville, NC: Pope AAF,N/A,N/A,N/A,N/A,N/A,N/A,N/A,N/A,N/A,N/A,N/A,N/A,N/A,N/A,N/A,N/A,
Rawala Kot, Pakistan: Rawalakot,N/A,N/A,N/A,N/A,N/A,N/A,N/A,N/A,N/A,N/A,N/A,N/A,N/A,N/A,N/A,N/A,
Athens, GA: Athens/Ben Epps,228.0,45180.97,176.0,32787.21,336.0,55687.97999999999,275.0,50581.049999999996,N/A,N/A,N/A,N/A,N/A,N/A,N/A,N/A,
Marion/Herrin, IL: Williamson County Regional,166.0,35778.17999999999,383.0,77967.01,197.0,34604.21,357.0,73169.76000000001,98.0,28084.190000000006,91.0,27190.16,84.0,23213.119999999995,91.0,25374.660000000003,
Shishmaref, AK: Shishmaref Airport,0,0,0,0,6.0,1261.46,2.0,328.82,1.0,1556.28,N/A,N/A,N/A,N/A,N/A,N/A,
Ambon, Indonesia: Pattimura,N/A,N/A,N/A,N/A,N/A,N/A,N/A,N/A,N/A,N/A,N/A,N/A,N/A,N/A,N/A,N/A,
Ancona, Italy: Falconara,N/A,N/A,N/A,N/A,N/A,N/A,N/A,N/A,N/A,N/A,N/A,N/A,N/A,N/A,N/A,N/A,
Palmdale, CA: Palmdale USAF Plant 42,277.0,77906.51999999997,365.0,84895.80000000003,451.0,104701.95000000004,425.0,93609.21999999997,N/A,N/A,N/A,N/A,N/A,N/A,N/A,N/A,
Manley Hot Springs, AK: Manley Hot Springs Airport,N/A,N/A,N/A,N/A,0,0,N/A,N/A,N/A,N/A,N/A,N/A,N/A,N/A,N/A,N/A,
Genting, Malaysia: Genting Airport,N/A,N/A,N/A,N/A,N/A,N/A,N/A,N/A,N/A,N/A,N/A,N/A,N/A,N/A,N/A,N/A,
Islesboro, ME: Islesboro Airport,N/A,N/A,N/A,N/A,N/A,N/A,N/A,N/A,N/A,N/A,N/A,N/A,N/A,N/A,N/A,N/A,
Baledogle, Somalia: Baledogle Airport,N/A,N/A,N/A,N/A,N/A,N/A,N/A,N/A,N/A,N/A,N/A,N/A,N/A,N/A,N/A,N/A,
Managua, Nicaragua: Augusto Cesar Sandino International,N/A,N/A,N/A,N/A,N/A,N/A,N/A,N/A,N/A,N/A,N/A,N/A,N/A,N/A,N/A,N/A,
San Julian, Argentina: San Julian Airport,N/A,N/A,N/A,N/A,N/A,N/A,N/A,N/A,N/A,N/A,N/A,N/A,N/A,N/A,N/A,N/A,
Trapani/Marsala, Italy: Trapani/Birgi,N/A,N/A,N/A,N/A,N/A,N/A,N/A,N/A,N/A,N/A,N/A,N/A,N/A,N/A,N/A,N/A,
Hatay, Japan: Hatay Airport,N/A,N/A,N/A,N/A,N/A,N/A,N/A,N/A,N/A,N/A,N/A,N/A,N/A,N/A,N/A,N/A,
Liberal, KS: Liberal Mid-America Regional,44.0,8595.45,61.0,11237.309999999998,83.0,11712.800000000003,40.0,3088.0899999999997,51.0,18016.03,35.0,11787.26,31.0,13687.01,43.0,15627.320000000002,
Porbandar, India: Porbandar Airport,N/A,N/A,N/A,N/A,N/A,N/A,N/A,N/A,N/A,N/A,N/A,N/A,N/A,N/A,N/A,N/A,
Tocoa, Honduras: Tocoa Airport,N/A,N/A,N/A,N/A,N/A,N/A,N/A,N/A,N/A,N/A,N/A,N/A,N/A,N/A,N/A,N/A,
Chinhae, South Korea: Jinhae,N/A,N/A,N/A,N/A,N/A,N/A,N/A,N/A,N/A,N/A,N/A,N/A,N/A,N/A,N/A,N/A,
Corinth, MS: Roscoe Turner,N/A,N/A,N/A,N/A,N/A,N/A,N/A,N/A,N/A,N/A,N/A,N/A,N/A,N/A,N/A,N/A,
Kuala Lumpur, Malaysia: Sultan Abdul Aziz Shah International,N/A,N/A,N/A,N/A,N/A,N/A,N/A,N/A,N/A,N/A,N/A,N/A,N/A,N/A,N/A,N/A,
Fairbanks/Ft. Wainwright, AK: Blair Lake,N/A,N/A,N/A,N/A,N/A,N/A,N/A,N/A,N/A,N/A,N/A,N/A,N/A,N/A,N/A,N/A,
Harbin, China: Taiping,N/A,N/A,N/A,N/A,N/A,N/A,N/A,N/A,N/A,N/A,N/A,N/A,N/A,N/A,N/A,N/A,
Chaoyang, China: Chaoyang Airport,N/A,N/A,N/A,N/A,N/A,N/A,N/A,N/A,N/A,N/A,N/A,N/A,N/A,N/A,N/A,N/A,
Fort Collins/Loveland, CO: Fort Collins-Loveland Municipal,995.0,177415.77000000002,1383.0,200751.32000000004,1537.0,239598.45,823.0,136617.86000000002,N/A,N/A,16.0,494.0,22.0,224.0,13.0,400.0,
Burao, Somalia: Burao Airport,N/A,N/A,N/A,N/A,N/A,N/A,N/A,N/A,N/A,N/A,N/A,N/A,N/A,N/A,N/A,N/A,
Bathurst, Australia: Bathurst Airport,N/A,N/A,N/A,N/A,N/A,N/A,N/A,N/A,N/A,N/A,N/A,N/A,N/A,N/A,N/A,N/A,
Barcelona, Spain: Barcelona-El Prat,N/A,N/A,N/A,N/A,N/A,N/A,N/A,N/A,N/A,N/A,N/A,N/A,N/A,N/A,N/A,N/A,
Welkom, South Africa: Welkom Airport,N/A,N/A,N/A,N/A,N/A,N/A,N/A,N/A,N/A,N/A,N/A,N/A,N/A,N/A,N/A,N/A,
Hope, AK: Hope Airport,N/A,N/A,N/A,N/A,N/A,N/A,N/A,N/A,N/A,N/A,N/A,N/A,N/A,N/A,N/A,N/A,
Athens, Greece: Eleftherios Venizelos International,N/A,N/A,N/A,N/A,N/A,N/A,N/A,N/A,N/A,N/A,N/A,N/A,N/A,N/A,N/A,N/A,
Yarmouth, Canada: Yarmouth Airport,N/A,N/A,N/A,N/A,N/A,N/A,N/A,N/A,N/A,N/A,N/A,N/A,N/A,N/A,N/A,N/A,
Chernofski, AK: Chernofski Harbor,N/A,N/A,N/A,N/A,N/A,N/A,N/A,N/A,N/A,N/A,N/A,N/A,N/A,N/A,N/A,N/A,
Nuguria, Papua New Guinea: Nuguria Airport,N/A,N/A,N/A,N/A,N/A,N/A,N/A,N/A,N/A,N/A,N/A,N/A,N/A,N/A,N/A,N/A,
Wunnumin Lake, Canada: Wunnumin Lake Airport,N/A,N/A,N/A,N/A,N/A,N/A,N/A,N/A,N/A,N/A,N/A,N/A,N/A,N/A,N/A,N/A,
Jiuquan, China: Jiayuguan,N/A,N/A,N/A,N/A,N/A,N/A,N/A,N/A,N/A,N/A,N/A,N/A,N/A,N/A,N/A,N/A,
Roanne, France: Roanne Airport,N/A,N/A,N/A,N/A,N/A,N/A,N/A,N/A,N/A,N/A,N/A,N/A,N/A,N/A,N/A,N/A,
Pakuashipi, Canada: St Augustin,N/A,N/A,N/A,N/A,N/A,N/A,N/A,N/A,N/A,N/A,N/A,N/A,N/A,N/A,N/A,N/A,
Cumana, Venezuela: Cumana Airport,N/A,N/A,N/A,N/A,N/A,N/A,N/A,N/A,N/A,N/A,N/A,N/A,N/A,N/A,N/A,N/A,
Kolkata, India: Netaji Subhash Chandra Bose International,N/A,N/A,N/A,N/A,N/A,N/A,N/A,N/A,N/A,N/A,N/A,N/A,N/A,N/A,N/A,N/A,
Black River Falls, WI: Black River Falls Area,N/A,N/A,N/A,N/A,N/A,N/A,N/A,N/A,N/A,N/A,N/A,N/A,N/A,N/A,N/A,N/A,
Baton Rouge, LA: Baton Rouge Metropolitan/Ryan Field,8266.0,1071610.38,10607.0,1390249.6000000006,8474.0,1109848.6999999995,9556.0,1201232.61,7656.0,1825210.3599999992,8790.0,2217751.23,7998.0,1966509.0400000007,8590.0,1988826.5699999998,
Moscow, Russia: Ostafyevo,N/A,N/A,N/A,N/A,N/A,N/A,N/A,N/A,N/A,N/A,N/A,N/A,N/A,N/A,N/A,N/A,
Santo Domingo, Dominican Republic: Herrera International,N/A,N/A,N/A,N/A,N/A,N/A,N/A,N/A,N/A,N/A,N/A,N/A,N/A,N/A,N/A,N/A,
Kavieng, Papua New Guinea: Kavieng Airport,N/A,N/A,N/A,N/A,N/A,N/A,N/A,N/A,N/A,N/A,N/A,N/A,N/A,N/A,N/A,N/A,
Chapleau, Canada: Chapleau Airport,N/A,N/A,N/A,N/A,N/A,N/A,N/A,N/A,N/A,N/A,N/A,N/A,N/A,N/A,N/A,N/A,
Hibbing, MN: Range Regional,304.0,51978.25999999999,336.0,57445.92,417.0,74124.73999999998,369.0,65391.640000000036,243.0,78499.45000000001,300.0,84896.76000000001,291.0,96371.07,281.0,85395.72000000002,
Salamanca, Spain: Matacan,N/A,N/A,N/A,N/A,N/A,N/A,N/A,N/A,N/A,N/A,N/A,N/A,N/A,N/A,N/A,N/A,
Port Protection, AK: Port Protection Airport,N/A,N/A,N/A,N/A,N/A,N/A,N/A,N/A,N/A,N/A,N/A,N/A,N/A,N/A,N/A,N/A,
Governador Valadares, Brazil: Governador Valadares Airport,N/A,N/A,N/A,N/A,N/A,N/A,N/A,N/A,N/A,N/A,N/A,N/A,N/A,N/A,N/A,N/A,
Saransk, Russia: Saransk Airport,N/A,N/A,N/A,N/A,N/A,N/A,N/A,N/A,N/A,N/A,N/A,N/A,N/A,N/A,N/A,N/A,
El Monte, CA: El Monte Airport,N/A,N/A,N/A,N/A,N/A,N/A,N/A,N/A,N/A,N/A,N/A,N/A,N/A,N/A,N/A,N/A,
Helsingborg, Sweden: Helsingborg Heliport,N/A,N/A,N/A,N/A,N/A,N/A,N/A,N/A,N/A,N/A,N/A,N/A,N/A,N/A,N/A,N/A,
Uberaba, Brazil: Mario de Almeida Franco,N/A,N/A,N/A,N/A,N/A,N/A,N/A,N/A,N/A,N/A,N/A,N/A,N/A,N/A,N/A,N/A,
Columbus, OH: Ohio State University,N/A,N/A,N/A,N/A,N/A,N/A,N/A,N/A,N/A,N/A,N/A,N/A,N/A,N/A,N/A,N/A,
Pensacola, FL: Pensacola International,7271.0,1163154.4300000006,9952.0,1340870.6199999992,9431.0,1265330.9500000002,9104.0,1297551.4600000002,14021.0,3026258.3300000024,19553.0,4249597.03,18730.0,4015055.259999999,17438.0,3589112.649999999,
Levelock, AK: Levelock Airport,4.0,541.04,N/A,N/A,0,0,0,0,N/A,N/A,N/A,N/A,N/A,N/A,N/A,N/A,
Leadville, CO: Lake County,N/A,N/A,N/A,N/A,N/A,N/A,N/A,N/A,N/A,N/A,N/A,N/A,N/A,N/A,N/A,N/A,
San Clemente Island, CA: San Clemente Island Nalf,N/A,N/A,N/A,N/A,N/A,N/A,N/A,N/A,N/A,N/A,N/A,N/A,N/A,N/A,N/A,N/A,
Chicago, IL: Du Page County,N/A,N/A,N/A,N/A,N/A,N/A,N/A,N/A,N/A,N/A,N/A,N/A,N/A,N/A,N/A,N/A,
Duchesne, UT: Duchesne Municipal,N/A,N/A,N/A,N/A,N/A,N/A,N/A,N/A,N/A,N/A,N/A,N/A,N/A,N/A,N/A,N/A,
Coffeyville, KS: Coffeyville Municipal,N/A,N/A,N/A,N/A,N/A,N/A,N/A,N/A,N/A,N/A,N/A,N/A,N/A,N/A,N/A,N/A,
Osorno, Chile: Canal Bajo Carlos Hott Siebert,N/A,N/A,N/A,N/A,N/A,N/A,N/A,N/A,N/A,N/A,N/A,N/A,N/A,N/A,N/A,N/A,
Clover Bay, AK: Clover Bay Airport,N/A,N/A,N/A,N/A,N/A,N/A,N/A,N/A,N/A,N/A,N/A,N/A,N/A,N/A,N/A,N/A,
Red Deer, Canada: Red Deer Regional,N/A,N/A,N/A,N/A,N/A,N/A,N/A,N/A,N/A,N/A,N/A,N/A,N/A,N/A,N/A,N/A,
Gweru, Zimbabwe: Gweru Thornhill,N/A,N/A,N/A,N/A,N/A,N/A,N/A,N/A,N/A,N/A,N/A,N/A,N/A,N/A,N/A,N/A,
Kupang, Indonesia: El Tari,N/A,N/A,N/A,N/A,N/A,N/A,N/A,N/A,N/A,N/A,N/A,N/A,N/A,N/A,N/A,N/A,
Palanga, Lithuania: Palanga International,N/A,N/A,N/A,N/A,N/A,N/A,N/A,N/A,N/A,N/A,N/A,N/A,N/A,N/A,N/A,N/A,
Idaho Falls, ID: Idaho Falls Regional,2123.0,340768.9,2594.0,433005.5199999999,3208.0,495896.9799999999,2970.0,472308.1100000001,2869.0,711230.9499999997,3511.0,858404.41,4184.0,947500.1099999999,3295.0,781501.5500000003,
Ulan-Ude, Russia: Mukhino,N/A,N/A,N/A,N/A,N/A,N/A,N/A,N/A,N/A,N/A,N/A,N/A,N/A,N/A,N/A,N/A,
Crosbyton, TX: Crosbyton Municipal,N/A,N/A,N/A,N/A,N/A,N/A,N/A,N/A,N/A,N/A,N/A,N/A,N/A,N/A,N/A,N/A,
Chute-Des-Passes, Canada: Chute-Des-Passes Airport,N/A,N/A,N/A,N/A,N/A,N/A,N/A,N/A,N/A,N/A,N/A,N/A,N/A,N/A,N/A,N/A,
Aurora, CO: Buckley AFB,N/A,N/A,N/A,N/A,N/A,N/A,N/A,N/A,N/A,N/A,N/A,N/A,N/A,N/A,N/A,N/A,
Brunswick, GA: McKinnon St Simons Island,N/A,N/A,N/A,N/A,N/A,N/A,N/A,N/A,N/A,N/A,N/A,N/A,N/A,N/A,N/A,N/A,
Xi'an, China: Xianyang,N/A,N/A,N/A,N/A,N/A,N/A,N/A,N/A,N/A,N/A,N/A,N/A,N/A,N/A,N/A,N/A,
Bay St. Louis, MS: Stennis International,N/A,N/A,N/A,N/A,N/A,N/A,N/A,N/A,N/A,N/A,N/A,N/A,N/A,N/A,N/A,N/A,
Tracy Arm, AK: Tracy Arm Airport,N/A,N/A,N/A,N/A,N/A,N/A,N/A,N/A,N/A,N/A,N/A,N/A,N/A,N/A,N/A,N/A,
Columbus, OH: Rickenbacker International,N/A,N/A,N/A,N/A,N/A,N/A,N/A,N/A,1605.0,20780.5,2268.0,16666.0,2465.0,13053.5,1815.0,17375.5,
Bullhead City, AZ: Laughlin/Bullhead International,95.0,13386.020000000002,142.0,18307.79,147.0,15839.499999999996,157.0,21607.65,N/A,N/A,1172.0,17390.0,1015.0,33125.0,1463.0,30399.0,
Fargo, ND: Hector International,4195.0,537495.2400000001,5026.0,640033.2400000003,4957.0,639736.5800000004,4626.0,567217.0899999999,10156.0,1971508.7000000002,9943.0,2171369.9499999997,10181.0,2281318.9100000006,8958.0,2040881.9299999992,
Marshfield, MA: Marshfield Municipal George Harlow Field,N/A,N/A,N/A,N/A,N/A,N/A,N/A,N/A,N/A,N/A,N/A,N/A,N/A,N/A,N/A,N/A,
Fort Bragg, CA: Fort Bragg Airport,N/A,N/A,N/A,N/A,N/A,N/A,N/A,N/A,N/A,N/A,N/A,N/A,N/A,N/A,N/A,N/A,
Wedjh, Saudi Arabia: Wedjh Airport,N/A,N/A,N/A,N/A,N/A,N/A,N/A,N/A,N/A,N/A,N/A,N/A,N/A,N/A,N/A,N/A,
Selawik, AK: Selawik Airport,2.0,700.56,0,0,3.0,768.45,0,0,N/A,N/A,N/A,N/A,N/A,N/A,N/A,N/A,
The Pas, Canada: The Pas Airport,N/A,N/A,N/A,N/A,N/A,N/A,N/A,N/A,N/A,N/A,N/A,N/A,N/A,N/A,N/A,N/A,
Seletar, Singapore: Seletar Airport,N/A,N/A,N/A,N/A,N/A,N/A,N/A,N/A,N/A,N/A,N/A,N/A,N/A,N/A,N/A,N/A,
Drummond Island, MI: Drummond Island Airport,N/A,N/A,N/A,N/A,N/A,N/A,N/A,N/A,N/A,N/A,N/A,N/A,N/A,N/A,N/A,N/A,
Mitspeh Ramon, Israel: Har Arikha,N/A,N/A,N/A,N/A,N/A,N/A,N/A,N/A,N/A,N/A,N/A,N/A,N/A,N/A,N/A,N/A,
Garrison, ND: Garrison Municipal,N/A,N/A,N/A,N/A,N/A,N/A,N/A,N/A,N/A,N/A,N/A,N/A,N/A,N/A,N/A,N/A,
Dry Bay, AK: Dry Bay Airport,N/A,N/A,N/A,N/A,N/A,N/A,N/A,N/A,N/A,N/A,N/A,N/A,N/A,N/A,N/A,N/A,
Olanchito, Honduras: El Arrayan,N/A,N/A,N/A,N/A,N/A,N/A,N/A,N/A,N/A,N/A,N/A,N/A,N/A,N/A,N/A,N/A,
Kelso, WA: Southwest Washington Regional,N/A,N/A,N/A,N/A,N/A,N/A,N/A,N/A,N/A,N/A,N/A,N/A,N/A,N/A,N/A,N/A,
Erbil, Iraq: Erbil International,N/A,N/A,N/A,N/A,N/A,N/A,N/A,N/A,N/A,N/A,N/A,N/A,N/A,N/A,N/A,N/A,
Indian Springs, NV: Creech AFB,N/A,N/A,N/A,N/A,N/A,N/A,N/A,N/A,N/A,N/A,N/A,N/A,N/A,N/A,N/A,N/A,
New Bight, The Bahamas: New Bight Airport,N/A,N/A,N/A,N/A,N/A,N/A,N/A,N/A,N/A,N/A,N/A,N/A,N/A,N/A,N/A,N/A,N/A,N/A,N/A,N/A,N/A,N/A,N/A,N/A,N/A,N/A,N/A,N/A,N/A,N/A,N/A,N/A,
Westsound, WA: Westsound Airport,N/A,N/A,N/A,N/A,2.0,332.44,N/A,N/A,N/A,N/A,N/A,N/A,N/A,N/A,N/A,N/A,
Hefei, China: Luogang,N/A,N/A,N/A,N/A,N/A,N/A,N/A,N/A,N/A,N/A,N/A,N/A,N/A,N/A,N/A,N/A,
Pafos, Cyprus: Pafos International,N/A,N/A,N/A,N/A,N/A,N/A,N/A,N/A,N/A,N/A,N/A,N/A,N/A,N/A,N/A,N/A,
St. Johns, Antigua and Barbuda: V C Bird International,N/A,N/A,N/A,N/A,N/A,N/A,N/A,N/A,N/A,N/A,N/A,N/A,N/A,N/A,N/A,N/A,
Sui, Pakistan: Sui Airport,N/A,N/A,N/A,N/A,N/A,N/A,N/A,N/A,N/A,N/A,N/A,N/A,N/A,N/A,N/A,N/A,
Berlin, Germany: Berlin Metropolitan Area,N/A,N/A,N/A,N/A,N/A,N/A,N/A,N/A,N/A,N/A,N/A,N/A,N/A,N/A,N/A,N/A,
Bear Fish Camp, AK: Bear Fish Camp Airport,N/A,N/A,N/A,N/A,N/A,N/A,N/A,N/A,N/A,N/A,N/A,N/A,N/A,N/A,N/A,N/A,
Heidelberg, Germany: Heidelberg AHP,N/A,N/A,N/A,N/A,N/A,N/A,N/A,N/A,N/A,N/A,N/A,N/A,N/A,N/A,N/A,N/A,
Berens River, Canada: Berens River Airport,N/A,N/A,N/A,N/A,N/A,N/A,N/A,N/A,N/A,N/A,N/A,N/A,N/A,N/A,N/A,N/A,
Bacolod, Philippines: Bacolod Airport,N/A,N/A,N/A,N/A,N/A,N/A,N/A,N/A,N/A,N/A,N/A,N/A,N/A,N/A,N/A,N/A,N/A,N/A,N/A,N/A,N/A,N/A,N/A,N/A,N/A,N/A,N/A,N/A,N/A,N/A,N/A,N/A,
Tumaco, Colombia: La Florida,N/A,N/A,N/A,N/A,N/A,N/A,N/A,N/A,N/A,N/A,N/A,N/A,N/A,N/A,N/A,N/A,
Mogadishu, Somalia: Mogadishu International,N/A,N/A,N/A,N/A,N/A,N/A,N/A,N/A,N/A,N/A,N/A,N/A,N/A,N/A,N/A,N/A,
York, PA: York Airport,N/A,N/A,N/A,N/A,N/A,N/A,N/A,N/A,N/A,N/A,N/A,N/A,N/A,N/A,N/A,N/A,
Sealing Point, AK: Sealing Point Airport,N/A,N/A,N/A,N/A,N/A,N/A,N/A,N/A,N/A,N/A,N/A,N/A,N/A,N/A,N/A,N/A,
Washington, PA: Washington County,N/A,N/A,N/A,N/A,N/A,N/A,N/A,N/A,N/A,N/A,N/A,N/A,N/A,N/A,N/A,N/A,
Fond Du Lac, WI: Fond Du Lac County,N/A,N/A,N/A,N/A,N/A,N/A,N/A,N/A,N/A,N/A,N/A,N/A,N/A,N/A,N/A,N/A,
Denver, CO: Centennial,N/A,N/A,N/A,N/A,N/A,N/A,N/A,N/A,N/A,N/A,N/A,N/A,N/A,N/A,N/A,N/A,
Muskogee, OK: Davis Field,N/A,N/A,N/A,N/A,N/A,N/A,N/A,N/A,N/A,N/A,N/A,N/A,N/A,N/A,N/A,N/A,
Middletown, OH: Middletown Regional/Hook Field,N/A,N/A,N/A,N/A,N/A,N/A,N/A,N/A,N/A,N/A,N/A,N/A,N/A,N/A,N/A,N/A,
St. John's, Canada: St. John's International,N/A,N/A,N/A,N/A,N/A,N/A,N/A,N/A,N/A,N/A,N/A,N/A,N/A,N/A,N/A,N/A,
Inverell, Australia: Inverell Airport,N/A,N/A,N/A,N/A,N/A,N/A,N/A,N/A,N/A,N/A,N/A,N/A,N/A,N/A,N/A,N/A,
Samarinda, Indonesia: Samarinda Airport,N/A,N/A,N/A,N/A,N/A,N/A,N/A,N/A,N/A,N/A,N/A,N/A,N/A,N/A,N/A,N/A,
Mudanjiang, China: Hailang,N/A,N/A,N/A,N/A,N/A,N/A,N/A,N/A,N/A,N/A,N/A,N/A,N/A,N/A,N/A,N/A,
Bisbee, AZ: Bisbee Municipal,N/A,N/A,N/A,N/A,N/A,N/A,N/A,N/A,N/A,N/A,N/A,N/A,N/A,N/A,N/A,N/A,
Augusta, GA: Daniel Field,N/A,N/A,N/A,N/A,N/A,N/A,N/A,N/A,N/A,N/A,N/A,N/A,N/A,N/A,N/A,N/A,
Madison, SD: Madison Municipal,N/A,N/A,N/A,N/A,N/A,N/A,N/A,N/A,N/A,N/A,N/A,N/A,N/A,N/A,N/A,N/A,
Stow, MA: Minute Man Air Field,N/A,N/A,N/A,N/A,N/A,N/A,N/A,N/A,N/A,N/A,N/A,N/A,N/A,N/A,N/A,N/A,
Ascension, Bolivia: Ascension Airport,N/A,N/A,N/A,N/A,N/A,N/A,N/A,N/A,N/A,N/A,N/A,N/A,N/A,N/A,N/A,N/A,
Lancaster, PA: Lancaster Airport,434.0,84828.87999999999,449.0,77839.8,481.0,90244.63000000002,467.0,85994.12000000001,6.0,1695.98,1.0,302.0,N/A,N/A,N/A,N/A,
Mbuji-Mayi, Congo (Kinshasa): Mbuji Mayi,N/A,N/A,N/A,N/A,N/A,N/A,N/A,N/A,N/A,N/A,N/A,N/A,N/A,N/A,N/A,N/A,
Illinois Creek, AK: Illinois Creek Airport,N/A,N/A,N/A,N/A,N/A,N/A,N/A,N/A,N/A,N/A,N/A,N/A,N/A,N/A,N/A,N/A,
Corsicana, TX: C David Campbell Field-Corsicana Municipal,N/A,N/A,N/A,N/A,N/A,N/A,N/A,N/A,N/A,N/A,N/A,N/A,N/A,N/A,N/A,N/A,
Koh Samui, Thailand: Samui,N/A,N/A,N/A,N/A,N/A,N/A,N/A,N/A,N/A,N/A,N/A,N/A,N/A,N/A,N/A,N/A,
Kerikeri, New Zealand: Kerikeri Airport,N/A,N/A,N/A,N/A,N/A,N/A,N/A,N/A,N/A,N/A,N/A,N/A,N/A,N/A,N/A,N/A,
Keyes Point, AK: Keyes Point Airport,N/A,N/A,N/A,N/A,N/A,N/A,N/A,N/A,N/A,N/A,N/A,N/A,N/A,N/A,N/A,N/A,
Tenerife, Spain: Tenerife Norte,N/A,N/A,N/A,N/A,N/A,N/A,N/A,N/A,N/A,N/A,N/A,N/A,N/A,N/A,N/A,N/A,
Ophir, AK: Ophir Airport,N/A,N/A,N/A,N/A,N/A,N/A,N/A,N/A,N/A,N/A,N/A,N/A,N/A,N/A,N/A,N/A,
Nouakchott, Mauritania: Nouakchott Airport,N/A,N/A,N/A,N/A,N/A,N/A,N/A,N/A,N/A,N/A,N/A,N/A,N/A,N/A,N/A,N/A,
Vientiane, Laos: Wattay International,N/A,N/A,N/A,N/A,N/A,N/A,N/A,N/A,N/A,N/A,N/A,N/A,N/A,N/A,N/A,N/A,
Cotonou, Benin: Card Bernardin Gadin de Cadjehoun International,N/A,N/A,N/A,N/A,N/A,N/A,N/A,N/A,N/A,N/A,N/A,N/A,N/A,N/A,N/A,N/A,
Sanford, FL: Orlando Sanford International,N/A,N/A,N/A,N/A,N/A,N/A,N/A,N/A,26933.0,397289.86,28658.0,267419.14,25747.0,183611.81,26998.0,248938.09999999998,
Cincinnati, OH: Cincinnati/Northern Kentucky International,38677.0,4507922.05,47922.0,5084789.070000002,44223.0,4815949.6999999955,45037.0,5174466.9399999995,47096.0,9302924.030000007,58968.0,10957074.950000005,58896.0,10349264.599999994,59126.0,9974123.129999999,
Oernskoeldsvik, Sweden: Ornskoldsvik,N/A,N/A,N/A,N/A,N/A,N/A,N/A,N/A,N/A,N/A,N/A,N/A,N/A,N/A,N/A,N/A,
Cholet, France: Cholet Le Pontreau,N/A,N/A,N/A,N/A,N/A,N/A,N/A,N/A,N/A,N/A,N/A,N/A,N/A,N/A,N/A,N/A,
Enterprise, OR: Enterprise Municipal,N/A,N/A,N/A,N/A,N/A,N/A,N/A,N/A,N/A,N/A,N/A,N/A,N/A,N/A,N/A,N/A,
Tracy, CA: Tracy Municipal,N/A,N/A,N/A,N/A,N/A,N/A,N/A,N/A,N/A,N/A,N/A,N/A,N/A,N/A,N/A,N/A,
Saginaw/Bay City/Midland, MI: MBS International,5001.0,664024.5899999997,5913.0,777859.8200000001,5888.0,775335.4099999998,5608.0,753292.48,2462.0,693685.9100000001,2649.0,759675.2000000001,2842.0,783732.4499999997,2600.0,687155.8200000001,
Logan, WV: Logan County,N/A,N/A,N/A,N/A,N/A,N/A,N/A,N/A,N/A,N/A,N/A,N/A,N/A,N/A,N/A,N/A,
Ahuas, Honduras: Auas,N/A,N/A,N/A,N/A,N/A,N/A,N/A,N/A,N/A,N/A,N/A,N/A,N/A,N/A,N/A,N/A,
Bangassou, Central African Republic: Bangassou Airport,N/A,N/A,N/A,N/A,N/A,N/A,N/A,N/A,N/A,N/A,N/A,N/A,N/A,N/A,N/A,N/A,
Manzini, Swaziland: Matsapha,N/A,N/A,N/A,N/A,N/A,N/A,N/A,N/A,N/A,N/A,N/A,N/A,N/A,N/A,N/A,N/A,
Oaxaca, Mexico: Xoxocotlan International,N/A,N/A,N/A,N/A,N/A,N/A,N/A,N/A,N/A,N/A,N/A,N/A,N/A,N/A,N/A,N/A,
Oecusse, Timor-Leste: Oecusse Airport,N/A,N/A,N/A,N/A,N/A,N/A,N/A,N/A,N/A,N/A,N/A,N/A,N/A,N/A,N/A,N/A,
Mekoryuk, AK: Mekoryuk Airport,2.0,536.96,0,0,3.0,685.5500000000001,1.0,226.01,N/A,N/A,N/A,N/A,N/A,N/A,N/A,N/A,
Santa Rosa, Bolivia: Santa Rosa Airport,N/A,N/A,N/A,N/A,N/A,N/A,N/A,N/A,N/A,N/A,N/A,N/A,N/A,N/A,N/A,N/A,
Modesto, CA: Modesto City-County-Harry Sham Field,155.0,29715.589999999997,577.0,99254.92999999995,190.0,34130.43,175.0,32339.24999999999,N/A,N/A,N/A,N/A,N/A,N/A,N/A,N/A,
Creswell, OR: Hobby Field,N/A,N/A,N/A,N/A,N/A,N/A,N/A,N/A,N/A,N/A,N/A,N/A,N/A,N/A,N/A,N/A,
San Andres Island, Colombia: Gustavo Rojas Pinilla,N/A,N/A,N/A,N/A,N/A,N/A,N/A,N/A,N/A,N/A,N/A,N/A,N/A,N/A,N/A,N/A,
Whitmore, AZ: Grand Canyon Bar Ten Airstrip,N/A,N/A,N/A,N/A,N/A,N/A,N/A,N/A,N/A,N/A,N/A,N/A,N/A,N/A,N/A,N/A,
Kalemie, Congo (Kinshasa): Kalemie Airport,N/A,N/A,N/A,N/A,N/A,N/A,N/A,N/A,N/A,N/A,N/A,N/A,N/A,N/A,N/A,N/A,
Serpentine, AK: Serpentine Airport,N/A,N/A,N/A,N/A,N/A,N/A,N/A,N/A,N/A,N/A,N/A,N/A,N/A,N/A,N/A,N/A,
Topeka, KS: Topeka Regional,153.0,24942.950000000004,282.0,40714.33,273.0,36845.14000000001,246.0,64295.45,N/A,N/A,N/A,N/A,N/A,N/A,3.0,459.0,
Linkoping, Sweden: Saab,N/A,N/A,N/A,N/A,N/A,N/A,N/A,N/A,N/A,N/A,N/A,N/A,N/A,N/A,N/A,N/A,
Governors Harbour, The Bahamas: Governors Harbour Airport,N/A,N/A,N/A,N/A,N/A,N/A,N/A,N/A,N/A,N/A,N/A,N/A,N/A,N/A,N/A,N/A,
Howell, MI: Livingston County Spencer J. Hardy,N/A,N/A,N/A,N/A,N/A,N/A,N/A,N/A,N/A,N/A,N/A,N/A,N/A,N/A,N/A,N/A,
Lille, France: Lille Lesquin,N/A,N/A,N/A,N/A,N/A,N/A,N/A,N/A,N/A,N/A,N/A,N/A,N/A,N/A,N/A,N/A,
Preveza, Greece: Aktio,N/A,N/A,N/A,N/A,N/A,N/A,N/A,N/A,N/A,N/A,N/A,N/A,N/A,N/A,N/A,N/A,
Landivisiau, France: Landivisiau Airport,N/A,N/A,N/A,N/A,N/A,N/A,N/A,N/A,N/A,N/A,N/A,N/A,N/A,N/A,N/A,N/A,
Sligo, Ireland: Sligo Bus Station,N/A,N/A,N/A,N/A,N/A,N/A,N/A,N/A,N/A,N/A,N/A,N/A,N/A,N/A,N/A,N/A,
Reykjavik, Iceland: Reykjavik Airport,N/A,N/A,N/A,N/A,N/A,N/A,N/A,N/A,N/A,N/A,N/A,N/A,N/A,N/A,N/A,N/A,
Mandan, ND: Mandan Municipal,N/A,N/A,N/A,N/A,N/A,N/A,N/A,N/A,N/A,N/A,N/A,N/A,N/A,N/A,N/A,N/A,
Thermopolis, WY: Hot Springs County Thermopolis Municipal,N/A,N/A,N/A,N/A,N/A,N/A,N/A,N/A,N/A,N/A,N/A,N/A,N/A,N/A,N/A,N/A,
Kuopio, Finland: Kuopio Airport,N/A,N/A,N/A,N/A,N/A,N/A,N/A,N/A,N/A,N/A,N/A,N/A,N/A,N/A,N/A,N/A,
Marshall, AK: Marshall Don Hunter Sr.,7.0,691.9100000000001,2.0,468.5,1.0,278.0,N/A,N/A,N/A,N/A,N/A,N/A,N/A,N/A,N/A,N/A,
Georgetown, TX: Georgetown Municipal,N/A,N/A,N/A,N/A,N/A,N/A,N/A,N/A,N/A,N/A,N/A,N/A,N/A,N/A,N/A,N/A,
Iron Mountain/Kingsfd, MI: Ford,160.0,34940.539999999986,187.0,36522.75000000001,199.0,40372.1,88.0,18914.569999999996,221.0,66815.87000000001,221.0,59998.43,243.0,69016.63,249.0,74776.37,
Loja, Ecuador: Ciudad de Catamayo,N/A,N/A,N/A,N/A,N/A,N/A,N/A,N/A,N/A,N/A,N/A,N/A,N/A,N/A,N/A,N/A,
