Likiep Island, Marshall Islands: Likiep Island Airport,N/A,N/A,N/A,N/A,N/A,N/A,N/A,N/A,N/A,N/A,N/A,N/A,N/A,N/A,N/A,N/A,
Ipil, Philippines: Ipil Airport,N/A,N/A,N/A,N/A,N/A,N/A,N/A,N/A,N/A,N/A,N/A,N/A,N/A,N/A,N/A,N/A,
Siem Reap, Cambodia: Siem Reap International,N/A,N/A,N/A,N/A,N/A,N/A,N/A,N/A,N/A,N/A,N/A,N/A,N/A,N/A,N/A,N/A,
Grand Rapids, MN: Grand Rapids/Itasca County-Gordon Newstrom Field,114.0,21637.680000000004,175.0,38158.36,193.0,36313.70999999999,140.0,27416.23999999999,N/A,N/A,N/A,N/A,N/A,N/A,N/A,N/A,
Wilkesboro, NC: Wilkes County,N/A,N/A,N/A,N/A,N/A,N/A,N/A,N/A,N/A,N/A,N/A,N/A,N/A,N/A,N/A,N/A,
Oran, Algeria: Tafaraoui,N/A,N/A,N/A,N/A,N/A,N/A,N/A,N/A,N/A,N/A,N/A,N/A,N/A,N/A,N/A,N/A,
Fairbanks, AK: Ladd AAF,N/A,N/A,N/A,N/A,N/A,N/A,N/A,N/A,N/A,N/A,N/A,N/A,N/A,N/A,N/A,N/A,
Richland, WA: Richland Airport,N/A,N/A,N/A,N/A,N/A,N/A,N/A,N/A,N/A,N/A,N/A,N/A,N/A,N/A,N/A,N/A,
Siuna, Nicaragua: Siuna Airport,N/A,N/A,N/A,N/A,N/A,N/A,N/A,N/A,N/A,N/A,N/A,N/A,N/A,N/A,N/A,N/A,
Cape Dyer, Canada: Cape Dyer Airport,N/A,N/A,N/A,N/A,N/A,N/A,N/A,N/A,N/A,N/A,N/A,N/A,N/A,N/A,N/A,N/A,
Muskegon, MI: Muskegon County,897.0,134053.78999999998,1066.0,170645.12000000002,1129.0,175744.25000000012,944.0,171037.57999999993,263.0,54975.09000000001,386.0,80768.64,489.0,116470.34,422.0,86527.33000000002,
Falls Church, VA: Washington-Virginia,N/A,N/A,N/A,N/A,N/A,N/A,N/A,N/A,N/A,N/A,N/A,N/A,N/A,N/A,N/A,N/A,
Skelleftea, Sweden: Skelleftea Airport,N/A,N/A,N/A,N/A,N/A,N/A,N/A,N/A,N/A,N/A,N/A,N/A,N/A,N/A,N/A,N/A,
Fukue, Japan: Fukue Airport,N/A,N/A,N/A,N/A,N/A,N/A,N/A,N/A,N/A,N/A,N/A,N/A,N/A,N/A,N/A,N/A,
Denton, TX: Denton Enterprise,N/A,N/A,N/A,N/A,N/A,N/A,N/A,N/A,N/A,N/A,N/A,N/A,N/A,N/A,N/A,N/A,
Saga, Japan: Saga Airport,N/A,N/A,N/A,N/A,N/A,N/A,N/A,N/A,N/A,N/A,N/A,N/A,N/A,N/A,N/A,N/A,
Roxboro, NC: Person County,N/A,N/A,N/A,N/A,N/A,N/A,N/A,N/A,N/A,N/A,N/A,N/A,N/A,N/A,N/A,N/A,
Smith Cove, AK: Smith Cove Airport,N/A,N/A,N/A,N/A,N/A,N/A,0,0,N/A,N/A,N/A,N/A,N/A,N/A,N/A,N/A,
Harrison, AR: Boone County,19.0,4160.49,43.0,9140.410000000002,43.0,9624.859999999999,26.0,6300.4,N/A,N/A,N/A,N/A,N/A,N/A,N/A,N/A,
Perito Moreno, Argentina: Perito Moreno Airport,N/A,N/A,N/A,N/A,N/A,N/A,N/A,N/A,N/A,N/A,N/A,N/A,N/A,N/A,N/A,N/A,
Larsen Bay, AK: Larsen Bay Airport,15.0,388.99,2.0,826.99,4.0,837.47,1.0,325.45,N/A,N/A,N/A,N/A,N/A,N/A,N/A,N/A,
Rijeka, Croatia: Rijeka Airport,N/A,N/A,N/A,N/A,N/A,N/A,N/A,N/A,N/A,N/A,N/A,N/A,N/A,N/A,N/A,N/A,
Kelowna, Canada: Kelowna Airport,N/A,N/A,N/A,N/A,N/A,N/A,N/A,N/A,N/A,N/A,N/A,N/A,N/A,N/A,N/A,N/A,
Gothenburg, Sweden: Gothenburg City,N/A,N/A,N/A,N/A,N/A,N/A,N/A,N/A,N/A,N/A,N/A,N/A,N/A,N/A,N/A,N/A,
San Pedro Sula, Honduras: Ramon Villeda Morales International,N/A,N/A,N/A,N/A,N/A,N/A,N/A,N/A,N/A,N/A,N/A,N/A,N/A,N/A,N/A,N/A,
Curuzu Cuatia, Argentina: Curuzu Cuatia Airport,N/A,N/A,N/A,N/A,N/A,N/A,N/A,N/A,N/A,N/A,N/A,N/A,N/A,N/A,N/A,N/A,
Arica, Chile: Chacalluta,N/A,N/A,N/A,N/A,N/A,N/A,N/A,N/A,N/A,N/A,N/A,N/A,N/A,N/A,N/A,N/A,
Colorado Springs, CO: USAF Academy Airfield,N/A,N/A,N/A,N/A,N/A,N/A,N/A,N/A,N/A,N/A,N/A,N/A,N/A,N/A,N/A,N/A,
Las Vegas, NV: North Las Vegas,N/A,N/A,N/A,N/A,N/A,N/A,N/A,N/A,N/A,N/A,N/A,N/A,N/A,N/A,N/A,N/A,
Macon, GA: Robins AFB,N/A,N/A,N/A,N/A,N/A,N/A,N/A,N/A,N/A,N/A,N/A,N/A,N/A,N/A,N/A,N/A,
Gothenburg, NE: Quinn Field,N/A,N/A,N/A,N/A,N/A,N/A,N/A,N/A,N/A,N/A,N/A,N/A,N/A,N/A,N/A,N/A,
Al Ain, United Arab Emirates: Al Ain International,N/A,N/A,N/A,N/A,N/A,N/A,N/A,N/A,N/A,N/A,N/A,N/A,N/A,N/A,N/A,N/A,
Mont Laurier, Canada: Mont Laurier Airport,N/A,N/A,N/A,N/A,N/A,N/A,N/A,N/A,N/A,N/A,N/A,N/A,N/A,N/A,N/A,N/A,
Bedwell Harbour, Canada: Bedwell Harbour Water Aerodrome,N/A,N/A,N/A,N/A,N/A,N/A,N/A,N/A,N/A,N/A,N/A,N/A,N/A,N/A,N/A,N/A,
Redencao, Brazil: Redencao Airport,N/A,N/A,N/A,N/A,N/A,N/A,N/A,N/A,N/A,N/A,N/A,N/A,N/A,N/A,N/A,N/A,
Bend/Redmond, OR: Roberts Field,725.0,96727.45999999999,1485.0,226379.98,1168.0,142845.59,1097.0,129312.16,4902.0,930734.2700000003,6072.0,1224563.7600000007,7284.0,1497798.0200000005,6448.0,1232976.2799999998,
Freetown, Sierra Leone: Hastings,N/A,N/A,N/A,N/A,N/A,N/A,N/A,N/A,N/A,N/A,N/A,N/A,N/A,N/A,N/A,N/A,
Columbus, MS: Columbus AFB,N/A,N/A,N/A,N/A,N/A,N/A,N/A,N/A,N/A,N/A,N/A,N/A,N/A,N/A,N/A,N/A,
Dinard, France: Dinard Pleurtuit St Malo,N/A,N/A,N/A,N/A,N/A,N/A,N/A,N/A,N/A,N/A,N/A,N/A,N/A,N/A,N/A,N/A,
Cuenca, Ecuador: Cuenca Airport,N/A,N/A,N/A,N/A,N/A,N/A,N/A,N/A,N/A,N/A,N/A,N/A,N/A,N/A,N/A,N/A,
Chignik Lake, AK: Chignik Lake Airport,N/A,N/A,N/A,N/A,N/A,N/A,N/A,N/A,N/A,N/A,N/A,N/A,N/A,N/A,N/A,N/A,
Uberlandia, Brazil: Uberlandia Airport,N/A,N/A,N/A,N/A,N/A,N/A,N/A,N/A,N/A,N/A,N/A,N/A,N/A,N/A,N/A,N/A,
Onion Bay, AK: Onion Bay Airport,N/A,N/A,N/A,N/A,N/A,N/A,N/A,N/A,N/A,N/A,N/A,N/A,N/A,N/A,N/A,N/A,
Campinas, Brazil: Viracopos International,N/A,N/A,N/A,N/A,N/A,N/A,N/A,N/A,N/A,N/A,N/A,N/A,N/A,N/A,N/A,N/A,
Upernavik, Greenland: Upernavik Airport,N/A,N/A,N/A,N/A,N/A,N/A,N/A,N/A,N/A,N/A,N/A,N/A,N/A,N/A,N/A,N/A,
Port Ashton, AK: Port Ashton Airport,N/A,N/A,N/A,N/A,N/A,N/A,N/A,N/A,N/A,N/A,N/A,N/A,N/A,N/A,N/A,N/A,
Spokane, WA: Fairchild AFB,N/A,N/A,N/A,N/A,N/A,N/A,N/A,N/A,N/A,N/A,N/A,N/A,N/A,N/A,N/A,N/A,
Chateauroux, France: Chateauroux Airport,N/A,N/A,N/A,N/A,N/A,N/A,N/A,N/A,N/A,N/A,N/A,N/A,N/A,N/A,N/A,N/A,
Atomic City, ID: Big Southern Butte,N/A,N/A,N/A,N/A,N/A,N/A,N/A,N/A,N/A,N/A,N/A,N/A,N/A,N/A,N/A,N/A,
Charlottetown, Canada: Charlottetown Airport,N/A,N/A,N/A,N/A,N/A,N/A,N/A,N/A,N/A,N/A,N/A,N/A,N/A,N/A,N/A,N/A,
Ayawasi, Indonesia: Ayawasi Airport,N/A,N/A,N/A,N/A,N/A,N/A,N/A,N/A,N/A,N/A,N/A,N/A,N/A,N/A,N/A,N/A,
Abha, Saudi Arabia: Abha Airport,N/A,N/A,N/A,N/A,N/A,N/A,N/A,N/A,N/A,N/A,N/A,N/A,N/A,N/A,N/A,N/A,
Billings, MT: Billings Logan International,4449.0,667274.5299999997,6249.0,875789.2099999997,7136.0,984344.4600000005,6112.0,864973.57,7421.0,1592293.9400000004,9533.0,2101981.0099999993,10827.0,2428924.610000001,9478.0,2011190.1200000008,
Glacier Creek, AK: Glacier Creek Airport,N/A,N/A,N/A,N/A,N/A,N/A,N/A,N/A,N/A,N/A,N/A,N/A,N/A,N/A,N/A,N/A,
Santa Maria, CA: Santa Maria Public/Capt. G. Allan Hancock Field,539.0,121911.88999999997,921.0,177241.12000000002,889.0,173458.69999999992,904.0,185511.4999999999,820.0,112056.78999999998,1101.0,170433.51,1252.0,179627.78000000003,1126.0,169035.69000000003,
Kanab, UT: Kanab Municipal,N/A,N/A,N/A,N/A,N/A,N/A,N/A,N/A,N/A,N/A,N/A,N/A,N/A,N/A,N/A,N/A,
Alor, Indonesia: Arcadia Municipal,N/A,N/A,N/A,N/A,N/A,N/A,N/A,N/A,N/A,N/A,N/A,N/A,N/A,N/A,N/A,N/A,
Roche Harbor, WA: Roche Harbor Airport,N/A,N/A,N/A,N/A,1.0,125.97,N/A,N/A,N/A,N/A,N/A,N/A,N/A,N/A,N/A,N/A,
Venice, Italy: Marco Polo International,N/A,N/A,N/A,N/A,N/A,N/A,N/A,N/A,N/A,N/A,N/A,N/A,N/A,N/A,N/A,N/A,
Tulcan, Ecuador: Tulcan Airport,N/A,N/A,N/A,N/A,N/A,N/A,N/A,N/A,N/A,N/A,N/A,N/A,N/A,N/A,N/A,N/A,
Wau, Papua New Guinea: Wau Airport,N/A,N/A,N/A,N/A,N/A,N/A,N/A,N/A,N/A,N/A,N/A,N/A,N/A,N/A,N/A,N/A,
Klagenfurt, Austria: Klagenfurt Worthersee International,N/A,N/A,N/A,N/A,N/A,N/A,N/A,N/A,N/A,N/A,N/A,N/A,N/A,N/A,N/A,N/A,
Apple Valley, CA: Apple Valley Airport,N/A,N/A,N/A,N/A,N/A,N/A,N/A,N/A,N/A,N/A,N/A,N/A,N/A,N/A,N/A,N/A,
Grenada, Grenada: Maurice Bishop International,N/A,N/A,N/A,N/A,N/A,N/A,N/A,N/A,N/A,N/A,N/A,N/A,N/A,N/A,N/A,N/A,
Vancouver, WA: Pearson Field,N/A,N/A,N/A,N/A,N/A,N/A,N/A,N/A,N/A,N/A,N/A,N/A,N/A,N/A,N/A,N/A,
Cooch Behar, India: Cooch Behar Airport,N/A,N/A,N/A,N/A,N/A,N/A,N/A,N/A,N/A,N/A,N/A,N/A,N/A,N/A,N/A,N/A,
Nogales, AZ: Nogales International,N/A,N/A,N/A,N/A,N/A,N/A,N/A,N/A,N/A,N/A,N/A,N/A,N/A,N/A,N/A,N/A,
Langkawi, Malaysia: Langkawi International,N/A,N/A,N/A,N/A,N/A,N/A,N/A,N/A,N/A,N/A,N/A,N/A,N/A,N/A,N/A,N/A,
Belfast, United Kingdom: Belfast City,N/A,N/A,N/A,N/A,N/A,N/A,N/A,N/A,N/A,N/A,N/A,N/A,N/A,N/A,N/A,N/A,
Alexandria Bay, NY: Maxson Airfield,N/A,N/A,N/A,N/A,N/A,N/A,N/A,N/A,N/A,N/A,N/A,N/A,N/A,N/A,N/A,N/A,
Anchorage, AK: Merrill Field,N/A,N/A,N/A,N/A,N/A,N/A,N/A,N/A,N/A,N/A,N/A,N/A,N/A,N/A,N/A,N/A,
Big Bay, AK: Big Bay Airport,N/A,N/A,N/A,N/A,N/A,N/A,N/A,N/A,N/A,N/A,N/A,N/A,N/A,N/A,N/A,N/A,
Augusta, GA: Augusta Regional at Bush Field,4385.0,734463.4400000001,5667.0,856699.4199999995,5351.0,788176.6900000003,5254.0,831260.0899999995,5501.0,1295710.6299999994,7450.0,1960816.11,6714.0,1509854.6900000006,6383.0,1504969.049999999,
Concord, CA: Buchanan Field,N/A,N/A,N/A,N/A,N/A,N/A,N/A,N/A,N/A,N/A,N/A,N/A,N/A,N/A,N/A,N/A,
Big Bear City, CA: Big Bear City Airport,N/A,N/A,N/A,N/A,N/A,N/A,N/A,N/A,N/A,N/A,N/A,N/A,N/A,N/A,N/A,N/A,
Bantry, Ireland: Bantry Airport,N/A,N/A,N/A,N/A,N/A,N/A,N/A,N/A,N/A,N/A,N/A,N/A,N/A,N/A,N/A,N/A,
Guilin, China: Liangjiang,N/A,N/A,N/A,N/A,N/A,N/A,N/A,N/A,N/A,N/A,N/A,N/A,N/A,N/A,N/A,N/A,
Hayward, WI: Sawyer County,N/A,N/A,N/A,N/A,N/A,N/A,N/A,N/A,N/A,N/A,N/A,N/A,N/A,N/A,N/A,N/A,
Angoon, AK: Angoon Seaplane Base,3.0,1147.5,3.0,753.14,3.0,885.5,1.0,269.51,N/A,N/A,N/A,N/A,N/A,N/A,N/A,N/A,
Teterboro, NJ: Teterboro Airport,N/A,N/A,N/A,N/A,N/A,N/A,N/A,N/A,N/A,N/A,N/A,N/A,N/A,N/A,N/A,N/A,
Kenora, Canada: Kenora Airport,N/A,N/A,N/A,N/A,N/A,N/A,N/A,N/A,N/A,N/A,N/A,N/A,N/A,N/A,N/A,N/A,
Willows, CA: Willows Glenn County,N/A,N/A,N/A,N/A,N/A,N/A,N/A,N/A,N/A,N/A,N/A,N/A,N/A,N/A,N/A,N/A,
Tifton, GA: Henry Tift Myers,N/A,N/A,N/A,N/A,N/A,N/A,N/A,N/A,N/A,N/A,N/A,N/A,N/A,N/A,N/A,N/A,
Nebraska, NE: Nebraska City Municipal,N/A,N/A,N/A,N/A,N/A,N/A,N/A,N/A,N/A,N/A,N/A,N/A,N/A,N/A,N/A,N/A,
Holguin, Cuba: Frank Pais International,N/A,N/A,N/A,N/A,N/A,N/A,N/A,N/A,N/A,N/A,N/A,N/A,N/A,N/A,N/A,N/A,
Davis/Woodland/Winters, CA: Yolo County,N/A,N/A,N/A,N/A,N/A,N/A,N/A,N/A,N/A,N/A,N/A,N/A,N/A,N/A,N/A,N/A,
Agrinion, Greece: Agrinion Airport,N/A,N/A,N/A,N/A,N/A,N/A,N/A,N/A,N/A,N/A,N/A,N/A,N/A,N/A,N/A,N/A,
Leaf Rapids, Canada: Leaf Rapids Airport,N/A,N/A,N/A,N/A,N/A,N/A,N/A,N/A,N/A,N/A,N/A,N/A,N/A,N/A,N/A,N/A,
Lecce, Italy: Lecce Airport,N/A,N/A,N/A,N/A,N/A,N/A,N/A,N/A,N/A,N/A,N/A,N/A,N/A,N/A,N/A,N/A,
Novosibirsk, Russia: Tolmachevo,N/A,N/A,N/A,N/A,N/A,N/A,N/A,N/A,N/A,N/A,N/A,N/A,N/A,N/A,N/A,N/A,
Morondava, Madagascar: Morondava Airport,N/A,N/A,N/A,N/A,N/A,N/A,N/A,N/A,N/A,N/A,N/A,N/A,N/A,N/A,N/A,N/A,
Mthatha, South Africa: Mthatha Airport,N/A,N/A,N/A,N/A,N/A,N/A,N/A,N/A,N/A,N/A,N/A,N/A,N/A,N/A,N/A,N/A,
Lebanon-Hanover, NH: Lebanon Municipal,563.0,134868.67,710.0,149595.53999999998,681.0,127243.77999999996,772.0,149503.20000000004,70.0,19045.91,88.0,25536.420000000002,93.0,28341.059999999998,78.0,20245.29,
Fort Bridger, WY: Fort Bridger Airport,N/A,N/A,N/A,N/A,N/A,N/A,N/A,N/A,N/A,N/A,N/A,N/A,N/A,N/A,N/A,N/A,
Goba, Ethiopia: Goba Airport,N/A,N/A,N/A,N/A,N/A,N/A,N/A,N/A,N/A,N/A,N/A,N/A,N/A,N/A,N/A,N/A,
Nikolski, AK: Nikolski AS,2.0,951.04,1.0,106.96,1.0,106.96,N/A,N/A,N/A,N/A,N/A,N/A,N/A,N/A,N/A,N/A,
Berlin, Germany: Tempelhof,N/A,N/A,N/A,N/A,N/A,N/A,N/A,N/A,N/A,N/A,N/A,N/A,N/A,N/A,N/A,N/A,
Newcastle, United Kingdom: Newcastle Airport,N/A,N/A,N/A,N/A,N/A,N/A,N/A,N/A,N/A,N/A,N/A,N/A,N/A,N/A,N/A,N/A,
Prairie Du Chien, WI: Prairie Du Chien Municipal,N/A,N/A,N/A,N/A,N/A,N/A,N/A,N/A,N/A,N/A,N/A,N/A,N/A,N/A,N/A,N/A,
Daup, Papua New Guinea: Daup Airport,N/A,N/A,N/A,N/A,N/A,N/A,N/A,N/A,N/A,N/A,N/A,N/A,N/A,N/A,N/A,N/A,
Chitato, Angola: Chitato Airport,N/A,N/A,N/A,N/A,N/A,N/A,N/A,N/A,N/A,N/A,N/A,N/A,N/A,N/A,N/A,N/A,
Lifuka, Tonga: Salote Pilolevu,N/A,N/A,N/A,N/A,N/A,N/A,N/A,N/A,N/A,N/A,N/A,N/A,N/A,N/A,N/A,N/A,
Ghardaia, Algeria: Noumerat Moufdi Zakaria,N/A,N/A,N/A,N/A,N/A,N/A,N/A,N/A,N/A,N/A,N/A,N/A,N/A,N/A,N/A,N/A,
Mineralnyye Vody, Russia: Mineralnyye Vody Airport,N/A,N/A,N/A,N/A,N/A,N/A,N/A,N/A,N/A,N/A,N/A,N/A,N/A,N/A,N/A,N/A,
Tikchik Lodge, AK: Tikchik Lodge Airport,N/A,N/A,N/A,N/A,N/A,N/A,N/A,N/A,N/A,N/A,N/A,N/A,N/A,N/A,N/A,N/A,
Wasilla, AK: Wasilla Airport,N/A,N/A,N/A,N/A,N/A,N/A,N/A,N/A,N/A,N/A,N/A,N/A,N/A,N/A,N/A,N/A,N/A,N/A,N/A,N/A,N/A,N/A,N/A,N/A,N/A,N/A,N/A,N/A,N/A,N/A,N/A,N/A,
Santander, Spain: Santander Airport,N/A,N/A,N/A,N/A,N/A,N/A,N/A,N/A,N/A,N/A,N/A,N/A,N/A,N/A,N/A,N/A,
Awasa, Ethiopia: Lake Awasa,N/A,N/A,N/A,N/A,N/A,N/A,N/A,N/A,N/A,N/A,N/A,N/A,N/A,N/A,N/A,N/A,
Smith Point, Australia: Smith Point Airport,N/A,N/A,N/A,N/A,N/A,N/A,N/A,N/A,N/A,N/A,N/A,N/A,N/A,N/A,N/A,N/A,
Chicago, IL: Chicago O'Hare International,242372.0,27586134.650000036,303874.0,32593836.980000056,283454.0,32987714.950000037,278412.0,33736687.72000006,324876.0,43354679.02999996,399179.0,53353851.03000001,421647.0,49106392.51999994,418787.0,45438414.489999995,
North Adams, MA: Harriman-and-West,N/A,N/A,N/A,N/A,N/A,N/A,N/A,N/A,N/A,N/A,N/A,N/A,N/A,N/A,N/A,N/A,
Horseshoe Bay, TX: Horseshoe Bay Resort,N/A,N/A,N/A,N/A,N/A,N/A,N/A,N/A,N/A,N/A,N/A,N/A,N/A,N/A,N/A,N/A,
Manchester, United Kingdom: Manchester Airport,N/A,N/A,N/A,N/A,N/A,N/A,N/A,N/A,N/A,N/A,N/A,N/A,N/A,N/A,N/A,N/A,
Big Spring, TX: Big Spring McMahon-Wrinkle,N/A,N/A,N/A,N/A,N/A,N/A,N/A,N/A,N/A,N/A,N/A,N/A,N/A,N/A,N/A,N/A,
Tuxtla Gutierrez, Mexico: Angel Albino Corzo,N/A,N/A,N/A,N/A,N/A,N/A,N/A,N/A,N/A,N/A,N/A,N/A,N/A,N/A,N/A,N/A,
Hornell, NY: Hornell Municipal,N/A,N/A,N/A,N/A,N/A,N/A,N/A,N/A,N/A,N/A,N/A,N/A,N/A,N/A,N/A,N/A,
Venetie, AK: Venetie Airport,1.0,301.37,1.0,243.98,N/A,N/A,1.0,296.07,N/A,N/A,N/A,N/A,N/A,N/A,N/A,N/A,
Moro, Papua New Guinea: Moro Airport,N/A,N/A,N/A,N/A,N/A,N/A,N/A,N/A,N/A,N/A,N/A,N/A,N/A,N/A,N/A,N/A,
Moosonee, Canada: Moosonee Airport,N/A,N/A,N/A,N/A,N/A,N/A,N/A,N/A,N/A,N/A,N/A,N/A,N/A,N/A,N/A,N/A,
Calais, France: Calais Dunkerque,N/A,N/A,N/A,N/A,N/A,N/A,N/A,N/A,N/A,N/A,N/A,N/A,N/A,N/A,N/A,N/A,
Ciudad Victoria, Mexico: General Pedro Jose Mendez International,N/A,N/A,N/A,N/A,N/A,N/A,N/A,N/A,N/A,N/A,N/A,N/A,N/A,N/A,N/A,N/A,
Aneityum, Vanuatu: Aneityum Airport,N/A,N/A,N/A,N/A,N/A,N/A,N/A,N/A,N/A,N/A,N/A,N/A,N/A,N/A,N/A,N/A,
Chemehuevi Valley, CA: Chemehuevi Valley Airport,N/A,N/A,N/A,N/A,N/A,N/A,N/A,N/A,N/A,N/A,N/A,N/A,N/A,N/A,N/A,N/A,
Tumbes, Peru: Cap. FAP Pedro Canga Rodriguez,N/A,N/A,N/A,N/A,N/A,N/A,N/A,N/A,N/A,N/A,N/A,N/A,N/A,N/A,N/A,N/A,
Florence, Italy: Firenze,N/A,N/A,N/A,N/A,N/A,N/A,N/A,N/A,N/A,N/A,N/A,N/A,N/A,N/A,N/A,N/A,
Florianopolis, Brazil: Hercilio Luz International,N/A,N/A,N/A,N/A,N/A,N/A,N/A,N/A,N/A,N/A,N/A,N/A,N/A,N/A,N/A,N/A,
Albemarle, NC: Stanly County,N/A,N/A,N/A,N/A,N/A,N/A,N/A,N/A,N/A,N/A,N/A,N/A,N/A,N/A,N/A,N/A,
Angoram, Papua New Guinea: Angoram Airport,N/A,N/A,N/A,N/A,N/A,N/A,N/A,N/A,N/A,N/A,N/A,N/A,N/A,N/A,N/A,N/A,
Gerlach, NV: Black Rock City,N/A,N/A,N/A,N/A,N/A,N/A,N/A,N/A,N/A,N/A,N/A,N/A,N/A,N/A,N/A,N/A,
Karlstad, Sweden: Karlstad Airport,N/A,N/A,N/A,N/A,N/A,N/A,N/A,N/A,N/A,N/A,N/A,N/A,N/A,N/A,N/A,N/A,
Kemmerer, WY: Kemmerer Municipal,N/A,N/A,N/A,N/A,N/A,N/A,N/A,N/A,N/A,N/A,N/A,N/A,N/A,N/A,N/A,N/A,
Sunriver, OR: Sunriver Airport,N/A,N/A,N/A,N/A,N/A,N/A,N/A,N/A,N/A,N/A,N/A,N/A,N/A,N/A,N/A,N/A,
Coffs Harbour, Australia: Coffs Harbour Airport,N/A,N/A,N/A,N/A,N/A,N/A,N/A,N/A,N/A,N/A,N/A,N/A,N/A,N/A,N/A,N/A,
Houston, TX: Marriot Helipad Hou.,N/A,N/A,N/A,N/A,N/A,N/A,N/A,N/A,N/A,N/A,N/A,N/A,N/A,N/A,N/A,N/A,
Iligan, Philippines: Maria Cristina,N/A,N/A,N/A,N/A,N/A,N/A,N/A,N/A,N/A,N/A,N/A,N/A,N/A,N/A,N/A,N/A,
Lidkoping, Sweden: Lidkoping Airport,N/A,N/A,N/A,N/A,N/A,N/A,N/A,N/A,N/A,N/A,N/A,N/A,N/A,N/A,N/A,N/A,
Kagua, Papua New Guinea: Kagua Airport,N/A,N/A,N/A,N/A,N/A,N/A,N/A,N/A,N/A,N/A,N/A,N/A,N/A,N/A,N/A,N/A,
Sao Jorge Island, Portugal: Sao Jorge,N/A,N/A,N/A,N/A,N/A,N/A,N/A,N/A,N/A,N/A,N/A,N/A,N/A,N/A,N/A,N/A,
Ulysses, KS: Ulysses Airport,N/A,N/A,N/A,N/A,N/A,N/A,N/A,N/A,N/A,N/A,N/A,N/A,N/A,N/A,N/A,N/A,
Papeete, French Polynesia: Tahiti Faa'a,N/A,N/A,N/A,N/A,N/A,N/A,N/A,N/A,N/A,N/A,N/A,N/A,N/A,N/A,N/A,N/A,
Polk Inlet, AK: Polk Inlet Airport,N/A,N/A,N/A,N/A,N/A,N/A,N/A,N/A,N/A,N/A,N/A,N/A,N/A,N/A,N/A,N/A,
Kemerovo, Russia: Kemerovo Airport,N/A,N/A,N/A,N/A,N/A,N/A,N/A,N/A,N/A,N/A,N/A,N/A,N/A,N/A,N/A,N/A,
Farsund, Norway: Lista,N/A,N/A,N/A,N/A,N/A,N/A,N/A,N/A,N/A,N/A,N/A,N/A,N/A,N/A,N/A,N/A,
Cheboygan, MI: Cheboygan County,N/A,N/A,N/A,N/A,N/A,N/A,N/A,N/A,N/A,N/A,N/A,N/A,N/A,N/A,N/A,N/A,
Andros Town, The Bahamas: Fresh Creek,N/A,N/A,N/A,N/A,N/A,N/A,N/A,N/A,N/A,N/A,N/A,N/A,N/A,N/A,N/A,N/A,
Midland/Odessa, TX: Odessa Schlemeyer Field,N/A,N/A,N/A,N/A,N/A,N/A,N/A,N/A,N/A,N/A,N/A,N/A,N/A,N/A,N/A,N/A,
Ozona, TX: Ozona Municipal,N/A,N/A,N/A,N/A,N/A,N/A,N/A,N/A,N/A,N/A,N/A,N/A,N/A,N/A,N/A,N/A,
Homer, AK: Homer Airport,52.0,11758.2,79.0,16836.309999999998,102.0,24030.670000000002,33.0,6589.54,128.0,44755.5,177.0,58358.56,248.0,104000.36999999998,171.0,50361.740000000005,
Birmingham, AL: Birmingham-Shuttlesworth International,19546.0,2002771.7899999996,24021.0,2401139.83,23656.0,2363727.1400000006,23292.0,2512084.349999999,27034.0,4995930.079999999,31112.0,6033257.280000002,30652.0,5787708.769999996,32613.0,6019329.609999999,
Baku, Azerbaijan: Baku Metropolitan Area,N/A,N/A,N/A,N/A,N/A,N/A,N/A,N/A,N/A,N/A,N/A,N/A,N/A,N/A,N/A,N/A,
Old Crow, Canada: Old Crow Airport,N/A,N/A,N/A,N/A,N/A,N/A,N/A,N/A,N/A,N/A,N/A,N/A,N/A,N/A,N/A,N/A,
Kachemak Bay, AK: Glacier Split,N/A,N/A,N/A,N/A,N/A,N/A,N/A,N/A,N/A,N/A,N/A,N/A,N/A,N/A,N/A,N/A,
Port Frederick, AK: Port Frederick Airport,N/A,N/A,N/A,N/A,N/A,N/A,N/A,N/A,N/A,N/A,N/A,N/A,N/A,N/A,N/A,N/A,N/A,N/A,N/A,N/A,N/A,N/A,N/A,N/A,N/A,N/A,N/A,N/A,N/A,N/A,N/A,N/A,
Marion, IN: Marion Municipal,N/A,N/A,N/A,N/A,N/A,N/A,N/A,N/A,N/A,N/A,N/A,N/A,N/A,N/A,N/A,N/A,
Jacmel, Haiti: Jacmel Airport,N/A,N/A,N/A,N/A,N/A,N/A,N/A,N/A,N/A,N/A,N/A,N/A,N/A,N/A,N/A,N/A,
Winnemucca, NV: Winnemucca Municipal,N/A,N/A,N/A,N/A,N/A,N/A,N/A,N/A,N/A,N/A,N/A,N/A,N/A,N/A,N/A,N/A,
Patna, India: Patna Airport,N/A,N/A,N/A,N/A,N/A,N/A,N/A,N/A,N/A,N/A,N/A,N/A,N/A,N/A,N/A,N/A,
Sacramento, CA: Sacramento Mather,N/A,N/A,N/A,N/A,N/A,N/A,N/A,N/A,N/A,N/A,N/A,N/A,N/A,N/A,N/A,N/A,
Chennai, India: Chennai International,N/A,N/A,N/A,N/A,N/A,N/A,N/A,N/A,N/A,N/A,N/A,N/A,N/A,N/A,N/A,N/A,
Batesville, AR: Batesville Regional,N/A,N/A,N/A,N/A,N/A,N/A,N/A,N/A,N/A,N/A,N/A,N/A,N/A,N/A,N/A,N/A,
Colombo, Sri Lanka: Colombo/Ratmalana,N/A,N/A,N/A,N/A,N/A,N/A,N/A,N/A,N/A,N/A,N/A,N/A,N/A,N/A,N/A,N/A,
Takhli, Thailand: Takhli Airport,N/A,N/A,N/A,N/A,N/A,N/A,N/A,N/A,N/A,N/A,N/A,N/A,N/A,N/A,N/A,N/A,
Okinawa, Japan: Naha,N/A,N/A,N/A,N/A,N/A,N/A,N/A,N/A,N/A,N/A,N/A,N/A,N/A,N/A,N/A,N/A,
Bayou La Batre, AL: Roy E. Ray,N/A,N/A,N/A,N/A,N/A,N/A,N/A,N/A,N/A,N/A,N/A,N/A,N/A,N/A,N/A,N/A,
Malmo, Sweden: Malmo Airport,N/A,N/A,N/A,N/A,N/A,N/A,N/A,N/A,N/A,N/A,N/A,N/A,N/A,N/A,N/A,N/A,
Coll Island, United Kingdom: Coll,N/A,N/A,N/A,N/A,N/A,N/A,N/A,N/A,N/A,N/A,N/A,N/A,N/A,N/A,N/A,N/A,
Rockford, IL: Chicago/Rockford International,1880.0,210186.39999999997,2286.0,261019.2500000001,2010.0,234834.53000000012,2073.0,271440.83999999997,2850.0,45950.5,2366.0,26552.5,2147.0,16470.65,2253.0,31460.5,
Marsa Brega, Libya: Marsa Brega S21,N/A,N/A,N/A,N/A,N/A,N/A,N/A,N/A,N/A,N/A,N/A,N/A,N/A,N/A,N/A,N/A,
Monterrey, Mexico: Del Norte International,N/A,N/A,N/A,N/A,N/A,N/A,N/A,N/A,N/A,N/A,N/A,N/A,N/A,N/A,N/A,N/A,
St. Johns, AZ: St. Johns Industrial Air Park,N/A,N/A,N/A,N/A,N/A,N/A,N/A,N/A,N/A,N/A,N/A,N/A,N/A,N/A,N/A,N/A,
Calabar, Nigeria: Calabar Airport,N/A,N/A,N/A,N/A,N/A,N/A,N/A,N/A,N/A,N/A,N/A,N/A,N/A,N/A,N/A,N/A,
Oklahoma City, OK: Will Rogers World,28928.0,2179968.15,36495.0,2778789.2500000014,35208.0,2635186.5099999984,35135.0,2813027.189999999,34016.0,6539700.13,42761.0,8434698.389999999,42511.0,8005898.080000004,42770.0,7597741.829999999,
Mannheim, Germany: Mannheim City,N/A,N/A,N/A,N/A,N/A,N/A,N/A,N/A,N/A,N/A,N/A,N/A,N/A,N/A,N/A,N/A,
Fort Dodge, IA: Fort Dodge Regional,221.0,38449.34,238.0,40884.31999999999,240.0,46721.00000000003,207.0,34750.01000000001,N/A,N/A,N/A,N/A,N/A,N/A,N/A,N/A,
Lab Lab, Papua New Guinea: Lab Lab Airport,N/A,N/A,N/A,N/A,N/A,N/A,N/A,N/A,N/A,N/A,N/A,N/A,N/A,N/A,N/A,N/A,
Karlovy Vary, Czech Republic: Karlovy Vary Airport,N/A,N/A,N/A,N/A,N/A,N/A,N/A,N/A,N/A,N/A,N/A,N/A,N/A,N/A,N/A,N/A,
Jumla, Nepal: Jumla Airport,N/A,N/A,N/A,N/A,N/A,N/A,N/A,N/A,N/A,N/A,N/A,N/A,N/A,N/A,N/A,N/A,
Pamol, Malaysia: Tungud/Pamol,N/A,N/A,N/A,N/A,N/A,N/A,N/A,N/A,N/A,N/A,N/A,N/A,N/A,N/A,N/A,N/A,
Kake, AK: Kake Seaplane Base,4.0,1150.87,7.0,1238.24,4.0,1196.06,4.0,1492.0700000000002,N/A,N/A,N/A,N/A,N/A,N/A,N/A,N/A,
Libenge, Congo (Kinshasa): Libenge Airport,N/A,N/A,N/A,N/A,N/A,N/A,N/A,N/A,N/A,N/A,N/A,N/A,N/A,N/A,N/A,N/A,
Sanliurfa, Turkey: Sanliurfa Airport,N/A,N/A,N/A,N/A,N/A,N/A,N/A,N/A,N/A,N/A,N/A,N/A,N/A,N/A,N/A,N/A,
Malindi, Kenya: Malindi Airport,N/A,N/A,N/A,N/A,N/A,N/A,N/A,N/A,N/A,N/A,N/A,N/A,N/A,N/A,N/A,N/A,
Bandar Seri Begawan, Brunei: Brunei International,N/A,N/A,N/A,N/A,N/A,N/A,N/A,N/A,N/A,N/A,N/A,N/A,N/A,N/A,N/A,N/A,
Otu, Colombia: Otu Airport,N/A,N/A,N/A,N/A,N/A,N/A,N/A,N/A,N/A,N/A,N/A,N/A,N/A,N/A,N/A,N/A,
Tacna, Peru: Coronel Carlos Ciriani Santa Rosa International,N/A,N/A,N/A,N/A,N/A,N/A,N/A,N/A,N/A,N/A,N/A,N/A,N/A,N/A,N/A,N/A,
Pikeville, KY: Pike County Hatcher Field,N/A,N/A,N/A,N/A,N/A,N/A,N/A,N/A,N/A,N/A,N/A,N/A,N/A,N/A,N/A,N/A,
New York, NY: World Trade Center Heliport,N/A,N/A,N/A,N/A,N/A,N/A,N/A,N/A,N/A,N/A,N/A,N/A,N/A,N/A,N/A,N/A,
Yamoussoukro, Cote d'Ivoire: Yamoussoukro Airport,N/A,N/A,N/A,N/A,N/A,N/A,N/A,N/A,N/A,N/A,N/A,N/A,N/A,N/A,N/A,N/A,
Ponta Pora, Brazil: Ponta Pora Airport,N/A,N/A,N/A,N/A,N/A,N/A,N/A,N/A,N/A,N/A,N/A,N/A,N/A,N/A,N/A,N/A,
Paimiut, AK: Paimiut Airport,N/A,N/A,N/A,N/A,N/A,N/A,N/A,N/A,N/A,N/A,N/A,N/A,N/A,N/A,N/A,N/A,
Deadhorse, AK: Inigok,N/A,N/A,N/A,N/A,N/A,N/A,N/A,N/A,N/A,N/A,N/A,N/A,N/A,N/A,N/A,N/A,
Matane, Canada: Matane Airport,N/A,N/A,N/A,N/A,N/A,N/A,N/A,N/A,N/A,N/A,N/A,N/A,N/A,N/A,N/A,N/A,
Castroville , TX: Castroville Municipal,N/A,N/A,N/A,N/A,N/A,N/A,N/A,N/A,N/A,N/A,N/A,N/A,N/A,N/A,N/A,N/A,
Addis Ababa, Ethiopia: Bole International,N/A,N/A,N/A,N/A,N/A,N/A,N/A,N/A,N/A,N/A,N/A,N/A,N/A,N/A,N/A,N/A,
Lakenheath, United Kingdom: RAF Lakenheath,N/A,N/A,N/A,N/A,N/A,N/A,N/A,N/A,N/A,N/A,N/A,N/A,N/A,N/A,N/A,N/A,
Barranca de Upia, Colombia: Barranca de Upia Airport,N/A,N/A,N/A,N/A,N/A,N/A,N/A,N/A,N/A,N/A,N/A,N/A,N/A,N/A,N/A,N/A,
Maracaibo, Venezuela: La Chinita International,N/A,N/A,N/A,N/A,N/A,N/A,N/A,N/A,N/A,N/A,N/A,N/A,N/A,N/A,N/A,N/A,
Lupin, Canada: Lupin Airport,N/A,N/A,N/A,N/A,N/A,N/A,N/A,N/A,N/A,N/A,N/A,N/A,N/A,N/A,N/A,N/A,
Taylor, AZ: Taylor Airport,N/A,N/A,N/A,N/A,N/A,N/A,N/A,N/A,N/A,N/A,N/A,N/A,N/A,N/A,N/A,N/A,
Kipnuk, AK: Kipnuk Airport,9.0,342.0,2.0,520.99,3.0,487.48,1.0,324.62,N/A,N/A,N/A,N/A,N/A,N/A,N/A,N/A,
Walvis Bay, Namibia: Walvis Bay Airport,N/A,N/A,N/A,N/A,N/A,N/A,N/A,N/A,N/A,N/A,N/A,N/A,N/A,N/A,N/A,N/A,
Amman, Jordan: Queen Alia International,N/A,N/A,N/A,N/A,N/A,N/A,N/A,N/A,N/A,N/A,N/A,N/A,N/A,N/A,N/A,N/A,
A Coruna, Spain: A Coruna Airport,N/A,N/A,N/A,N/A,N/A,N/A,N/A,N/A,N/A,N/A,N/A,N/A,N/A,N/A,N/A,N/A,
Clovis, NM: Clovis Municipal,9.0,2794.3,18.0,5424.880000000001,19.0,5788.469999999999,32.0,7144.3099999999995,N/A,N/A,N/A,N/A,N/A,N/A,N/A,N/A,
Mombasa, Kenya: Mombasa Moi International,N/A,N/A,N/A,N/A,N/A,N/A,N/A,N/A,N/A,N/A,N/A,N/A,N/A,N/A,N/A,N/A,
Inishmore, Ireland: Inishmore Airport,N/A,N/A,N/A,N/A,N/A,N/A,N/A,N/A,N/A,N/A,N/A,N/A,N/A,N/A,N/A,N/A,
Hamilton, MT: Ravalli County,N/A,N/A,N/A,N/A,N/A,N/A,N/A,N/A,N/A,N/A,N/A,N/A,N/A,N/A,N/A,N/A,
Scilly Isles, United Kingdom: Scilly Isles Airport,N/A,N/A,N/A,N/A,N/A,N/A,N/A,N/A,N/A,N/A,N/A,N/A,N/A,N/A,N/A,N/A,
Coffman Cove, AK: Coffman Cove Seaplane Base,N/A,N/A,1.0,252.49,N/A,N/A,1.0,394.3,N/A,N/A,N/A,N/A,N/A,N/A,N/A,N/A,
Abeche, Chad: Abeche Airport,N/A,N/A,N/A,N/A,N/A,N/A,N/A,N/A,N/A,N/A,N/A,N/A,N/A,N/A,N/A,N/A,
Douala, Cameroon: Douala Airport,N/A,N/A,N/A,N/A,N/A,N/A,N/A,N/A,N/A,N/A,N/A,N/A,N/A,N/A,N/A,N/A,
Basse Terre, Guadeloupe: Baillif,N/A,N/A,N/A,N/A,N/A,N/A,N/A,N/A,N/A,N/A,N/A,N/A,N/A,N/A,N/A,N/A,
Atlanta, GA: Hartsfield-Jackson Atlanta International,157252.0,14124063.139999988,189537.0,15861888.180000009,186999.0,14713096.990000006,204169.0,15723614.220000017,287477.0,33451518.900000002,371773.0,40807956.21000002,375986.0,38281373.70999998,389925.0,36784603.65999999,
Virac, Philippines: Virac Airport,N/A,N/A,N/A,N/A,N/A,N/A,N/A,N/A,N/A,N/A,N/A,N/A,N/A,N/A,N/A,N/A,
Nikiski, AK: Nikiski Private Airstrip,N/A,N/A,N/A,N/A,N/A,N/A,N/A,N/A,N/A,N/A,N/A,N/A,N/A,N/A,N/A,N/A,
Fort Nelson, Canada: Fort Nelson Airport,N/A,N/A,N/A,N/A,N/A,N/A,N/A,N/A,N/A,N/A,N/A,N/A,N/A,N/A,N/A,N/A,
Krabi, Thailand: Krabi Airport,N/A,N/A,N/A,N/A,N/A,N/A,N/A,N/A,N/A,N/A,N/A,N/A,N/A,N/A,N/A,N/A,
Kawthaung, Burma: Kawthaung Airport,N/A,N/A,N/A,N/A,N/A,N/A,N/A,N/A,N/A,N/A,N/A,N/A,N/A,N/A,N/A,N/A,
Uranium City, Canada: Uranium City Airport,N/A,N/A,N/A,N/A,N/A,N/A,N/A,N/A,N/A,N/A,N/A,N/A,N/A,N/A,N/A,N/A,
Laredo, TX: Laredo Municipal,N/A,N/A,N/A,N/A,N/A,N/A,N/A,N/A,N/A,N/A,N/A,N/A,N/A,N/A,N/A,N/A,
Kish Island, Iran: Kish Island Airport,N/A,N/A,N/A,N/A,N/A,N/A,N/A,N/A,N/A,N/A,N/A,N/A,N/A,N/A,N/A,N/A,
Takotna, AK: Takotna Airport,N/A,N/A,N/A,N/A,N/A,N/A,1.0,380.0,N/A,N/A,N/A,N/A,N/A,N/A,N/A,N/A,
Amari, Estonia: Amari Airport,N/A,N/A,N/A,N/A,N/A,N/A,N/A,N/A,N/A,N/A,N/A,N/A,N/A,N/A,N/A,N/A,
Santa Barbara, CA: Santa Barbara Municipal,3450.0,726389.9700000001,5088.0,941806.4699999995,4262.0,831826.6999999996,3972.0,801791.3,7078.0,1627997.7100000007,7668.0,1999056.6400000001,7965.0,1971249.8700000003,7423.0,1788089.3999999994,
Taku Lodge, AK: Taku Seaplane Base,N/A,N/A,N/A,N/A,N/A,N/A,N/A,N/A,N/A,N/A,N/A,N/A,N/A,N/A,N/A,N/A,
Paonia, CO: North Fork Valley,N/A,N/A,N/A,N/A,N/A,N/A,N/A,N/A,N/A,N/A,N/A,N/A,N/A,N/A,N/A,N/A,
Tyonek, AK: Tyonek Airport,N/A,N/A,N/A,N/A,N/A,N/A,N/A,N/A,N/A,N/A,N/A,N/A,N/A,N/A,N/A,N/A,
Grass Valley, CA: Nevada County Air Park,N/A,N/A,N/A,N/A,N/A,N/A,N/A,N/A,N/A,N/A,N/A,N/A,N/A,N/A,N/A,N/A,
Luebeck, Germany: Lubeck Blankensee,N/A,N/A,N/A,N/A,N/A,N/A,N/A,N/A,N/A,N/A,N/A,N/A,N/A,N/A,N/A,N/A,
Beaver Inlet, AK: Beaver Inlet Seaport,N/A,N/A,N/A,N/A,N/A,N/A,N/A,N/A,N/A,N/A,N/A,N/A,N/A,N/A,N/A,N/A,
Dowagiac, MI: Dowagiac Municipal,N/A,N/A,N/A,N/A,N/A,N/A,N/A,N/A,N/A,N/A,N/A,N/A,N/A,N/A,N/A,N/A,
Belo Horizonte, Brazil: Belo Horizonte Metropolitan Area,N/A,N/A,N/A,N/A,N/A,N/A,N/A,N/A,N/A,N/A,N/A,N/A,N/A,N/A,N/A,N/A,
Borrego Springs, CA: Borrego Valley,N/A,N/A,N/A,N/A,N/A,N/A,N/A,N/A,N/A,N/A,N/A,N/A,N/A,N/A,N/A,N/A,
Selief Bay, AK: Selief Bay Airport,N/A,N/A,N/A,N/A,N/A,N/A,N/A,N/A,N/A,N/A,N/A,N/A,N/A,N/A,N/A,N/A,
Tucuman, Argentina: Tucuman Airport,N/A,N/A,N/A,N/A,N/A,N/A,N/A,N/A,N/A,N/A,N/A,N/A,N/A,N/A,N/A,N/A,
