Name of the city,|1993_Q1 num of people|,|1993_Q1 total price|,|1993_Q2 num of people|,|1993_Q2 total price|,|1993_Q3 num of people|,|1993_Q3 total price|,|1993_Q4 num of people|,|1993_Q4 total price|,|2015_Q1 num of people|,|2015_Q1 total price|,|2015_Q2 num of people|,|2015_Q2 total price|,|2015_Q3 num of people|,|2015_Q3 total price|,|2015_Q4 num of people|,|2015_Q4 total price|,
Prince George, Canada: Prince George Airport,N/A,N/A,N/A,N/A,N/A,N/A,N/A,N/A,N/A,N/A,N/A,N/A,N/A,N/A,N/A,N/A,
San Carlos, CA: San Carlos Airport,N/A,N/A,N/A,N/A,N/A,N/A,N/A,N/A,N/A,N/A,N/A,N/A,N/A,N/A,N/A,N/A,
Yogyakarta, Indonesia: Adisutjipto,N/A,N/A,N/A,N/A,N/A,N/A,N/A,N/A,N/A,N/A,N/A,N/A,N/A,N/A,N/A,N/A,
Kos, Greece: Kos Airport,N/A,N/A,N/A,N/A,N/A,N/A,N/A,N/A,N/A,N/A,N/A,N/A,N/A,N/A,N/A,N/A,
Saarbrucken, Germany: Saarbrucken Airport,N/A,N/A,N/A,N/A,N/A,N/A,N/A,N/A,N/A,N/A,N/A,N/A,N/A,N/A,N/A,N/A,
Brockport, NY: Ledgedale Airpark,N/A,N/A,N/A,N/A,N/A,N/A,N/A,N/A,N/A,N/A,N/A,N/A,N/A,N/A,N/A,N/A,
Tehran, Iran: Mehrabad International,N/A,N/A,N/A,N/A,N/A,N/A,N/A,N/A,N/A,N/A,N/A,N/A,N/A,N/A,N/A,N/A,
Houston, TX: Ellington,905.0,127832.50000000001,1103.0,148140.76999999996,1056.0,155766.94,1005.0,144673.28,N/A,N/A,N/A,N/A,N/A,N/A,N/A,N/A,
Steamboat Springs, CO: Steamboat Springs/Bob Adams Field,1802.0,196511.39000000007,705.0,103778.79999999996,839.0,130394.72999999995,910.0,130721.97,N/A,N/A,N/A,N/A,N/A,N/A,N/A,N/A,
Collarenebri, Australia: Collarenebri Airport,N/A,N/A,N/A,N/A,N/A,N/A,N/A,N/A,N/A,N/A,N/A,N/A,N/A,N/A,N/A,N/A,
Sullivan Bay, Canada: Sullivan Bay Water Aerodrome,N/A,N/A,N/A,N/A,N/A,N/A,N/A,N/A,N/A,N/A,N/A,N/A,N/A,N/A,N/A,N/A,
Charleston, SC: Charleston AFB/International,10733.0,1441408.7400000005,14896.0,1894044.8300000005,13978.0,1764356.1999999988,15740.0,1814472.2800000003,30655.0,5424387.439999999,42432.0,7765118.389999994,41450.0,6850354.680000001,40322.0,6680693.909999998,
Gualaco, Honduras: Jicalapa,N/A,N/A,N/A,N/A,N/A,N/A,N/A,N/A,N/A,N/A,N/A,N/A,N/A,N/A,N/A,N/A,
Pantnagar, India: Pantnagar Airport,N/A,N/A,N/A,N/A,N/A,N/A,N/A,N/A,N/A,N/A,N/A,N/A,N/A,N/A,N/A,N/A,
Pleasant Harbour, AK: Pleasant Harbour Airport,N/A,N/A,N/A,N/A,N/A,N/A,N/A,N/A,N/A,N/A,N/A,N/A,N/A,N/A,N/A,N/A,
Pemba, Mozambique: Pemba Airport,N/A,N/A,N/A,N/A,N/A,N/A,N/A,N/A,N/A,N/A,N/A,N/A,N/A,N/A,N/A,N/A,
Santa Clara, Cuba: Abel Santamaria,N/A,N/A,N/A,N/A,N/A,N/A,N/A,N/A,N/A,N/A,N/A,N/A,N/A,N/A,N/A,N/A,
Merced, CA: Merced Regional/Macready Field,36.0,9871.329999999998,172.0,34982.240000000005,50.0,10779.310000000003,56.0,13545.12,11.0,2410.33,16.0,5559.01,3.0,1386.0,N/A,N/A,
Fort Chipewyan, Canada: Fort Chipewyan Airport,N/A,N/A,N/A,N/A,N/A,N/A,N/A,N/A,N/A,N/A,N/A,N/A,N/A,N/A,N/A,N/A,
Cape Town, South Africa: Cape Town International,N/A,N/A,N/A,N/A,N/A,N/A,N/A,N/A,N/A,N/A,N/A,N/A,N/A,N/A,N/A,N/A,
Duncan, OK: Halliburton Field,N/A,N/A,N/A,N/A,N/A,N/A,N/A,N/A,N/A,N/A,N/A,N/A,N/A,N/A,N/A,N/A,
Catania, Italy: Catania-Fontanarossa,N/A,N/A,N/A,N/A,N/A,N/A,N/A,N/A,N/A,N/A,N/A,N/A,N/A,N/A,N/A,N/A,
Hachijo Jima Island, Japan: Hachijo Jima Island Airport,N/A,N/A,N/A,N/A,N/A,N/A,N/A,N/A,N/A,N/A,N/A,N/A,N/A,N/A,N/A,N/A,
Jolo, Philippines: Jolo Airport,N/A,N/A,N/A,N/A,N/A,N/A,N/A,N/A,N/A,N/A,N/A,N/A,N/A,N/A,N/A,N/A,
Tucson, AZ: Marana Regional,N/A,N/A,N/A,N/A,N/A,N/A,N/A,N/A,N/A,N/A,N/A,N/A,N/A,N/A,N/A,N/A,
Andakombe, Papua New Guinea: Andakombe Airport,N/A,N/A,N/A,N/A,N/A,N/A,N/A,N/A,N/A,N/A,N/A,N/A,N/A,N/A,N/A,N/A,
Pilot Point, AK: Ugashik Bay,N/A,N/A,N/A,N/A,N/A,N/A,N/A,N/A,N/A,N/A,N/A,N/A,N/A,N/A,N/A,N/A,
Faro, Canada: Faro Airport,N/A,N/A,N/A,N/A,N/A,N/A,N/A,N/A,N/A,N/A,N/A,N/A,N/A,N/A,N/A,N/A,
Waterbury, CT: Waterbury Oxford,N/A,N/A,N/A,N/A,N/A,N/A,N/A,N/A,N/A,N/A,N/A,N/A,N/A,N/A,N/A,N/A,
Half Moon Bay, CA: Half Moon Bay Airport,N/A,N/A,N/A,N/A,N/A,N/A,N/A,N/A,N/A,N/A,N/A,N/A,N/A,N/A,N/A,N/A,
Lompoc, CA: Vandenberg AFB,N/A,N/A,N/A,N/A,N/A,N/A,N/A,N/A,N/A,N/A,N/A,N/A,N/A,N/A,N/A,N/A,
Batticaloa, Sri Lanka: Batticaloa Airport,N/A,N/A,N/A,N/A,N/A,N/A,N/A,N/A,N/A,N/A,N/A,N/A,N/A,N/A,N/A,N/A,
Gaylord, MI: Gaylord Regional,N/A,N/A,N/A,N/A,N/A,N/A,N/A,N/A,N/A,N/A,N/A,N/A,N/A,N/A,N/A,N/A,
Dire Dawa, Ethiopia: Aba Tenna Dejazmatch Yilma,N/A,N/A,N/A,N/A,N/A,N/A,N/A,N/A,N/A,N/A,N/A,N/A,N/A,N/A,N/A,N/A,
Fortaleza, Brazil: Pinto Martins International,N/A,N/A,N/A,N/A,N/A,N/A,N/A,N/A,N/A,N/A,N/A,N/A,N/A,N/A,N/A,N/A,
Montego Bay, Jamaica: Sangster International,N/A,N/A,N/A,N/A,N/A,N/A,N/A,N/A,N/A,N/A,N/A,N/A,N/A,N/A,N/A,N/A,
Lanai, HI: Lanai Airport,1359.0,29724.659999999996,1345.0,30607.75,1370.0,21979.02,1174.0,30952.56,137.0,65164.88,108.0,35372.12,68.0,12380.93,73.0,15478.75,
Conway, SC: Conway-Horry County,N/A,N/A,N/A,N/A,N/A,N/A,N/A,N/A,N/A,N/A,N/A,N/A,N/A,N/A,N/A,N/A,
Millbrook, NY: Sky Acres,N/A,N/A,N/A,N/A,N/A,N/A,N/A,N/A,N/A,N/A,N/A,N/A,N/A,N/A,N/A,N/A,
Puttaparthi, India: Puttaprathe,N/A,N/A,N/A,N/A,N/A,N/A,N/A,N/A,N/A,N/A,N/A,N/A,N/A,N/A,N/A,N/A,
Tikehau, French Polynesia: Tikehau Airport,N/A,N/A,N/A,N/A,N/A,N/A,N/A,N/A,N/A,N/A,N/A,N/A,N/A,N/A,N/A,N/A,
Doha, Qatar: Al Udeid AB,N/A,N/A,N/A,N/A,N/A,N/A,N/A,N/A,N/A,N/A,N/A,N/A,N/A,N/A,N/A,N/A,
Temple, TX: Draughon-Miller Central Texas Regional,N/A,N/A,N/A,N/A,N/A,N/A,N/A,N/A,N/A,N/A,N/A,N/A,N/A,N/A,N/A,N/A,
Atlanta, GA: Dekalb Peachtree,N/A,N/A,N/A,N/A,N/A,N/A,N/A,N/A,N/A,N/A,N/A,N/A,N/A,N/A,N/A,N/A,
Tacoma, WA: McChord Field,N/A,N/A,N/A,N/A,N/A,N/A,N/A,N/A,N/A,N/A,N/A,N/A,N/A,N/A,N/A,N/A,
Makoua, Congo (Brazaville): Makoua Airport,N/A,N/A,N/A,N/A,N/A,N/A,N/A,N/A,N/A,N/A,N/A,N/A,N/A,N/A,N/A,N/A,
Nushagak Bay, AK: Nushagak Bay Airport,N/A,N/A,N/A,N/A,N/A,N/A,N/A,N/A,N/A,N/A,N/A,N/A,N/A,N/A,N/A,N/A,
Joinville, Brazil: Joinville Airport,N/A,N/A,N/A,N/A,N/A,N/A,N/A,N/A,N/A,N/A,N/A,N/A,N/A,N/A,N/A,N/A,
Hondo, TX: South Texas Regional at Hondo,N/A,N/A,N/A,N/A,N/A,N/A,N/A,N/A,N/A,N/A,N/A,N/A,N/A,N/A,N/A,N/A,
Powell Point, The Bahamas: Powell Point Airport,N/A,N/A,N/A,N/A,N/A,N/A,N/A,N/A,N/A,N/A,N/A,N/A,N/A,N/A,N/A,N/A,
Bardstown, KY: Samuels Field,N/A,N/A,N/A,N/A,N/A,N/A,N/A,N/A,N/A,N/A,N/A,N/A,N/A,N/A,N/A,N/A,
Hancock/Houghton, MI: Houghton County Memorial,399.0,72181.49,370.0,66897.75,442.0,75984.81999999999,487.0,84868.28000000001,460.0,126125.46999999997,584.0,143631.22,634.0,170590.47,631.0,166029.78000000006,
Lathrop Wells, NV: Jackass Aeropark,N/A,N/A,N/A,N/A,N/A,N/A,N/A,N/A,N/A,N/A,N/A,N/A,N/A,N/A,N/A,N/A,
McMinnville, TN: Warren County Memorial,N/A,N/A,N/A,N/A,N/A,N/A,N/A,N/A,N/A,N/A,N/A,N/A,N/A,N/A,N/A,N/A,
Bishkek, Kyrgyzstan: Manas,N/A,N/A,N/A,N/A,N/A,N/A,N/A,N/A,N/A,N/A,N/A,N/A,N/A,N/A,N/A,N/A,
Rioja, Peru: Rioja Airport,N/A,N/A,N/A,N/A,N/A,N/A,N/A,N/A,N/A,N/A,N/A,N/A,N/A,N/A,N/A,N/A,
Bend, OR: Bend Municipal,N/A,N/A,N/A,N/A,N/A,N/A,N/A,N/A,N/A,N/A,N/A,N/A,N/A,N/A,N/A,N/A,
Carrabassett, ME: Sugarloaf Regional,N/A,N/A,N/A,N/A,N/A,N/A,N/A,N/A,N/A,N/A,N/A,N/A,N/A,N/A,N/A,N/A,
Batouri, Cameroon: Batouri Airport,N/A,N/A,N/A,N/A,N/A,N/A,N/A,N/A,N/A,N/A,N/A,N/A,N/A,N/A,N/A,N/A,
Melinda, Belize: Melinda Airport,N/A,N/A,N/A,N/A,N/A,N/A,N/A,N/A,N/A,N/A,N/A,N/A,N/A,N/A,N/A,N/A,
Chelyabinsk, Russia: Chelyabinsk Airport,N/A,N/A,N/A,N/A,N/A,N/A,N/A,N/A,N/A,N/A,N/A,N/A,N/A,N/A,N/A,N/A,
Craig, AK: Craig Seaplane Base,4.0,1175.06,14.0,3181.46,15.0,4003.92,5.0,1177.47,N/A,N/A,N/A,N/A,N/A,N/A,N/A,N/A,
Saipan, TT: Francisco C. Ada Saipan International,2512.0,100758.68999999997,2402.0,98244.55999999997,2311.0,115002.51999999996,2202.0,115708.56000000001,283.0,82919.98,196.0,131094.25999999995,228.0,114820.92000000001,184.0,93603.93000000001,
Elcho Island, Australia: Elcho Island Airport,N/A,N/A,N/A,N/A,N/A,N/A,N/A,N/A,N/A,N/A,N/A,N/A,N/A,N/A,N/A,N/A,
Nondalton, AK: Nondalton Airport,N/A,N/A,N/A,N/A,N/A,N/A,N/A,N/A,N/A,N/A,N/A,N/A,N/A,N/A,N/A,N/A,
Miramichi, Canada: Miramichi Airport,N/A,N/A,N/A,N/A,N/A,N/A,N/A,N/A,N/A,N/A,N/A,N/A,N/A,N/A,N/A,N/A,
Silver Salmon Creek, AK: Silver Salmon Creek Airport,N/A,N/A,N/A,N/A,N/A,N/A,N/A,N/A,N/A,N/A,N/A,N/A,N/A,N/A,N/A,N/A,
Bornite/Ruby Creek, AK: Bornite Upper,N/A,N/A,N/A,N/A,N/A,N/A,N/A,N/A,N/A,N/A,N/A,N/A,N/A,N/A,N/A,N/A,
Dinsmore, CA: Dinsmore Airport,N/A,N/A,N/A,N/A,N/A,N/A,N/A,N/A,N/A,N/A,N/A,N/A,N/A,N/A,N/A,N/A,
Miami, FL: Miami Executive,N/A,N/A,N/A,N/A,N/A,N/A,N/A,N/A,N/A,N/A,N/A,N/A,N/A,N/A,N/A,N/A,
Akrotiri, Cyprus: Akrotiri Airport,N/A,N/A,N/A,N/A,N/A,N/A,N/A,N/A,N/A,N/A,N/A,N/A,N/A,N/A,N/A,N/A,
Apataki, French Polynesia: Apataki Airport,N/A,N/A,N/A,N/A,N/A,N/A,N/A,N/A,N/A,N/A,N/A,N/A,N/A,N/A,N/A,N/A,
Christmas Island, Christmas Island: Christmas Island Airport,N/A,N/A,N/A,N/A,N/A,N/A,N/A,N/A,N/A,N/A,N/A,N/A,N/A,N/A,N/A,N/A,
Beauvais, France: Beauvais Tille,N/A,N/A,N/A,N/A,N/A,N/A,N/A,N/A,N/A,N/A,N/A,N/A,N/A,N/A,N/A,N/A,
Rosh-Pina, Israel: Izhak Ben Yaakov,N/A,N/A,N/A,N/A,N/A,N/A,N/A,N/A,N/A,N/A,N/A,N/A,N/A,N/A,N/A,N/A,
St. James, MI: Beaver Island,N/A,N/A,N/A,N/A,N/A,N/A,N/A,N/A,N/A,N/A,N/A,N/A,N/A,N/A,N/A,N/A,
Del Rio, TX: Del Rio International,N/A,N/A,N/A,N/A,N/A,N/A,N/A,N/A,N/A,N/A,N/A,N/A,N/A,N/A,N/A,N/A,
Ndola, Zambia: Ndola Airport,N/A,N/A,N/A,N/A,N/A,N/A,N/A,N/A,N/A,N/A,N/A,N/A,N/A,N/A,N/A,N/A,
Raspberry Strait, AK: Raspberry Straits,N/A,N/A,N/A,N/A,N/A,N/A,N/A,N/A,N/A,N/A,N/A,N/A,N/A,N/A,N/A,N/A,
Red Wing, MN: Red Wing Regional,N/A,N/A,N/A,N/A,N/A,N/A,N/A,N/A,N/A,N/A,N/A,N/A,N/A,N/A,N/A,N/A,
San Angelo, TX: San Angelo Regional/Mathis Field,1032.0,153029.33000000002,1101.0,184349.3500000001,1014.0,159326.13000000012,1085.0,176759.9500000001,1359.0,354530.93000000005,1737.0,443784.58,1596.0,406146.08999999985,1551.0,391092.8999999999,
Changzhi, China: Changzhi Airport,N/A,N/A,N/A,N/A,N/A,N/A,N/A,N/A,N/A,N/A,N/A,N/A,N/A,N/A,N/A,N/A,
Chicago, IL: Chicago Executive,N/A,N/A,N/A,N/A,N/A,N/A,N/A,N/A,N/A,N/A,N/A,N/A,N/A,N/A,N/A,N/A,
Lake of the Ozarks, MO: Lee C Fine Memorial,N/A,N/A,N/A,N/A,N/A,N/A,N/A,N/A,N/A,N/A,N/A,N/A,N/A,N/A,N/A,N/A,
Kodiak, AK: Kodiak Airport,377.0,38913.25000000001,438.0,65427.65000000002,736.0,99767.90999999997,311.0,36735.090000000004,861.0,206310.34999999998,1365.0,366581.0400000001,1857.0,484802.17000000016,1279.0,286594.6500000001,
St. Anthony, Canada: St. Anthony Airport,N/A,N/A,N/A,N/A,N/A,N/A,N/A,N/A,N/A,N/A,N/A,N/A,N/A,N/A,N/A,N/A,
Franca, Brazil: Franca Airport,N/A,N/A,N/A,N/A,N/A,N/A,N/A,N/A,N/A,N/A,N/A,N/A,N/A,N/A,N/A,N/A,
Greer, SC: Greenville-Spartanburg International,9905.0,1512066.84,12919.0,1856953.2599999995,12524.0,1759068.610000001,12852.0,1808435.4099999995,17559.0,3524235.440000001,22442.0,4503746.289999999,22508.0,4363576.909999999,22667.0,4054255.5400000024,
Istanbul, Turkey: Ataturk,N/A,N/A,N/A,N/A,N/A,N/A,N/A,N/A,N/A,N/A,N/A,N/A,N/A,N/A,N/A,N/A,
Agades, Niger: Mano Dayak,N/A,N/A,N/A,N/A,N/A,N/A,N/A,N/A,N/A,N/A,N/A,N/A,N/A,N/A,N/A,N/A,
Porto Amboim, Angola: Porto Amboim Airport,N/A,N/A,N/A,N/A,N/A,N/A,N/A,N/A,N/A,N/A,N/A,N/A,N/A,N/A,N/A,N/A,
Reid Cove, AK: Reid Cove Airport,N/A,N/A,N/A,N/A,N/A,N/A,N/A,N/A,N/A,N/A,N/A,N/A,N/A,N/A,N/A,N/A,
Sokoto, Nigeria: Sokoto Airport,N/A,N/A,N/A,N/A,N/A,N/A,N/A,N/A,N/A,N/A,N/A,N/A,N/A,N/A,N/A,N/A,
McCord, AK: McCord Seaplane Base,N/A,N/A,N/A,N/A,N/A,N/A,N/A,N/A,N/A,N/A,N/A,N/A,N/A,N/A,N/A,N/A,
Belgaum, India: Belgaum Airport,N/A,N/A,N/A,N/A,N/A,N/A,N/A,N/A,N/A,N/A,N/A,N/A,N/A,N/A,N/A,N/A,
Bluefields, Nicaragua: Bluefields Airport,N/A,N/A,N/A,N/A,N/A,N/A,N/A,N/A,N/A,N/A,N/A,N/A,N/A,N/A,N/A,N/A,
Edmonton, Canada: Edmonton Namao Heliport,N/A,N/A,N/A,N/A,N/A,N/A,N/A,N/A,N/A,N/A,N/A,N/A,N/A,N/A,N/A,N/A,
Tulear, Madagascar: Tulear Airport,N/A,N/A,N/A,N/A,N/A,N/A,N/A,N/A,N/A,N/A,N/A,N/A,N/A,N/A,N/A,N/A,
Encino, TX: El Coyote Ranch,N/A,N/A,N/A,N/A,N/A,N/A,N/A,N/A,N/A,N/A,N/A,N/A,N/A,N/A,N/A,N/A,
Wales, AK: Wales Airport,N/A,N/A,0,0,2.0,778.0699999999999,1.0,287.97,N/A,N/A,N/A,N/A,N/A,N/A,N/A,N/A,
Midland/Odessa, TX: Midland International,11644.0,305672.9299999998,13217.0,390337.7800000001,13255.0,369336.4400000001,12892.0,429848.07000000007,11565.0,1918191.8299999994,13184.0,2272412.3900000006,13340.0,2356256.010000001,12972.0,2166143.27,
Juiz de Fora, Brazil: Juiz,N/A,N/A,N/A,N/A,N/A,N/A,N/A,N/A,N/A,N/A,N/A,N/A,N/A,N/A,N/A,N/A,
Brandon, Canada: Brandon Municipal,N/A,N/A,N/A,N/A,N/A,N/A,N/A,N/A,N/A,N/A,N/A,N/A,N/A,N/A,N/A,N/A,
American Falls, ID: American Falls Airport,N/A,N/A,N/A,N/A,N/A,N/A,N/A,N/A,N/A,N/A,N/A,N/A,N/A,N/A,N/A,N/A,
Kitoi Bay, AK: Kitoi Bay Airport,N/A,N/A,N/A,N/A,N/A,N/A,N/A,N/A,N/A,N/A,N/A,N/A,N/A,N/A,N/A,N/A,
Santa Cruz das Flores, Portugal: Flores,N/A,N/A,N/A,N/A,N/A,N/A,N/A,N/A,N/A,N/A,N/A,N/A,N/A,N/A,N/A,N/A,
Williams, AZ: H. A. Clark Memorial Field,N/A,N/A,N/A,N/A,N/A,N/A,N/A,N/A,N/A,N/A,N/A,N/A,N/A,N/A,N/A,N/A,
Xining, China: Xining Airport,N/A,N/A,N/A,N/A,N/A,N/A,N/A,N/A,N/A,N/A,N/A,N/A,N/A,N/A,N/A,N/A,
Arrecife, Spain: Lanzarote,N/A,N/A,N/A,N/A,N/A,N/A,N/A,N/A,N/A,N/A,N/A,N/A,N/A,N/A,N/A,N/A,
Chandler, AZ: Chandler Municipal,N/A,N/A,N/A,N/A,N/A,N/A,N/A,N/A,N/A,N/A,N/A,N/A,N/A,N/A,N/A,N/A,
Sioux Lookout, Canada: Sioux Lookout Airport,N/A,N/A,N/A,N/A,N/A,N/A,N/A,N/A,N/A,N/A,N/A,N/A,N/A,N/A,N/A,N/A,
Shillong, India: Barapani,N/A,N/A,N/A,N/A,N/A,N/A,N/A,N/A,N/A,N/A,N/A,N/A,N/A,N/A,N/A,N/A,
Clarksburg/Fairmont, WV: North Central West Virginia,293.0,70586.81000000003,330.0,66438.10000000002,392.0,81675.85000000003,366.0,75613.79999999999,436.0,24583.11,566.0,34244.479999999996,485.0,27600.9,477.0,34782.060000000005,
Blear Lake, AK: Blear Lake Airport,N/A,N/A,N/A,N/A,N/A,N/A,N/A,N/A,N/A,N/A,N/A,N/A,N/A,N/A,N/A,N/A,
Izmir, Turkey: Cigli,N/A,N/A,N/A,N/A,N/A,N/A,N/A,N/A,N/A,N/A,N/A,N/A,N/A,N/A,N/A,N/A,
El Centro, CA: Imperial County,102.0,33408.350000000006,131.0,44409.99999999999,89.0,29451.899999999994,119.0,35465.469999999994,2.0,664.5,N/A,N/A,N/A,N/A,N/A,N/A,
Komatsu, Japan: Komatsu Airport,N/A,N/A,N/A,N/A,N/A,N/A,N/A,N/A,N/A,N/A,N/A,N/A,N/A,N/A,N/A,N/A,
Yecheon, South Korea: Yecheon Airport,N/A,N/A,N/A,N/A,N/A,N/A,N/A,N/A,N/A,N/A,N/A,N/A,N/A,N/A,N/A,N/A,
Ivanof Bay, AK: Ivanof Bay Seaplane Base,N/A,N/A,N/A,N/A,N/A,N/A,N/A,N/A,N/A,N/A,N/A,N/A,N/A,N/A,N/A,N/A,
Nadi, Fiji: Nadi International,N/A,N/A,N/A,N/A,N/A,N/A,N/A,N/A,N/A,N/A,N/A,N/A,N/A,N/A,N/A,N/A,
Zhezkazgan, Kazakhstan: Zhezkazgan Airport,N/A,N/A,N/A,N/A,N/A,N/A,N/A,N/A,N/A,N/A,N/A,N/A,N/A,N/A,N/A,N/A,
Carlisle, PA: Carlisle Airport,N/A,N/A,N/A,N/A,N/A,N/A,N/A,N/A,N/A,N/A,N/A,N/A,N/A,N/A,N/A,N/A,
Ensenada, Mexico: General Alberto L. Salinas Carranza,N/A,N/A,N/A,N/A,N/A,N/A,N/A,N/A,N/A,N/A,N/A,N/A,N/A,N/A,N/A,N/A,
Cordova, AK: Merle K Mudhole Smith,252.0,16426.85,215.0,24318.21,281.0,36170.52,207.0,18514.55,253.0,48879.619999999995,377.0,73711.15,611.0,134556.79,291.0,58218.579999999994,
Asheville, NC: Asheville Regional,3676.0,529121.5399999997,6047.0,750832.7300000002,7089.0,887788.8799999995,5774.0,803634.8599999998,7069.0,1338125.38,10096.0,2009864.9900000007,10962.0,2035818.59,9366.0,1744757.460000001,
Hanus Bay, AK: Hanus Bay Airport,N/A,N/A,N/A,N/A,N/A,N/A,N/A,N/A,N/A,N/A,N/A,N/A,N/A,N/A,N/A,N/A,
Tacoma, WA: Gray AAF,N/A,N/A,N/A,N/A,N/A,N/A,N/A,N/A,N/A,N/A,N/A,N/A,N/A,N/A,N/A,N/A,
Fort McMurray, Canada: Fort McMurray Airport,N/A,N/A,N/A,N/A,N/A,N/A,N/A,N/A,N/A,N/A,N/A,N/A,N/A,N/A,N/A,N/A,
New Iberia, LA: Acadiana Regional,N/A,N/A,N/A,N/A,N/A,N/A,N/A,N/A,N/A,N/A,N/A,N/A,N/A,N/A,N/A,N/A,
San Juan, Argentina: San Juan Airport,N/A,N/A,N/A,N/A,N/A,N/A,N/A,N/A,N/A,N/A,N/A,N/A,N/A,N/A,N/A,N/A,
Hesperia, CA: Hesperia Airport,N/A,N/A,N/A,N/A,N/A,N/A,N/A,N/A,N/A,N/A,N/A,N/A,N/A,N/A,N/A,N/A,
Sao Tome Island, Sao Tome and Principe: Salazar,N/A,N/A,N/A,N/A,N/A,N/A,N/A,N/A,N/A,N/A,N/A,N/A,N/A,N/A,N/A,N/A,
Morafenobe, Madagascar: Morafenobe Airport,N/A,N/A,N/A,N/A,N/A,N/A,N/A,N/A,N/A,N/A,N/A,N/A,N/A,N/A,N/A,N/A,
Naga, Philippines: Naga Airport,N/A,N/A,N/A,N/A,N/A,N/A,N/A,N/A,N/A,N/A,N/A,N/A,N/A,N/A,N/A,N/A,
Eisenach, Germany: Eisenach Kindel,N/A,N/A,N/A,N/A,N/A,N/A,N/A,N/A,N/A,N/A,N/A,N/A,N/A,N/A,N/A,N/A,
Columbus, MS: Columbus-Lowndes County,N/A,N/A,N/A,N/A,N/A,N/A,N/A,N/A,N/A,N/A,N/A,N/A,N/A,N/A,N/A,N/A,
Gloucester/Cheltenham, United Kingdom: Gloucestershire,N/A,N/A,N/A,N/A,N/A,N/A,N/A,N/A,N/A,N/A,N/A,N/A,N/A,N/A,N/A,N/A,
Nashville, TN: John C Tune,N/A,N/A,N/A,N/A,N/A,N/A,N/A,N/A,N/A,N/A,N/A,N/A,N/A,N/A,N/A,N/A,
Honolulu, HI: Honolulu International,132077.0,7112778.640000005,134604.0,8887166.040000027,148103.0,8295935.43,133303.0,8425144.110000005,117972.0,19168892.900000017,127218.0,23298926.439999998,126479.0,21062016.34999999,129751.0,22732946.74000001,
Bhavnagar, India: Bhavnagar Airport,N/A,N/A,N/A,N/A,N/A,N/A,N/A,N/A,N/A,N/A,N/A,N/A,N/A,N/A,N/A,N/A,
Ilorin, Nigeria: Ilorin Airport,N/A,N/A,N/A,N/A,N/A,N/A,N/A,N/A,N/A,N/A,N/A,N/A,N/A,N/A,N/A,N/A,
Patterson, LA: Harry P Williams Memorial,N/A,N/A,N/A,N/A,N/A,N/A,N/A,N/A,N/A,N/A,N/A,N/A,N/A,N/A,N/A,N/A,
Miles City, MT: Frank Wiley Field,7.0,1742.16,7.0,1218.02,6.0,1121.19,10.0,2443.33,N/A,N/A,N/A,N/A,N/A,N/A,N/A,N/A,
Hana, HI: Hana Airport,289.0,8166.029999999999,185.0,8330.46,198.0,9458.03,114.0,3670.95,N/A,N/A,N/A,N/A,N/A,N/A,N/A,N/A,
Malolo Lailai, Fiji: Malolo Lailai Airport,N/A,N/A,N/A,N/A,N/A,N/A,N/A,N/A,N/A,N/A,N/A,N/A,N/A,N/A,N/A,N/A,
Ashland, WV: Tri-State/Milton J. Ferguson Field,1468.0,263257.86000000016,1737.0,272082.17000000004,1831.0,312806.59999999986,1797.0,307269.8300000001,2185.0,216299.48000000007,3137.0,269502.60000000003,3064.0,235702.64,1843.0,214178.1199999999,
Solwezi, Zambia: Solwezi Airport,N/A,N/A,N/A,N/A,N/A,N/A,N/A,N/A,N/A,N/A,N/A,N/A,N/A,N/A,N/A,N/A,
Harrisburg, PA: Capital City,N/A,N/A,N/A,N/A,N/A,N/A,N/A,N/A,N/A,N/A,N/A,N/A,N/A,N/A,N/A,N/A,
Eufaula, AL: Weedon Field,N/A,N/A,N/A,N/A,N/A,N/A,N/A,N/A,N/A,N/A,N/A,N/A,N/A,N/A,N/A,N/A,
Delta, CO: Blake Field,N/A,N/A,N/A,N/A,N/A,N/A,N/A,N/A,N/A,N/A,N/A,N/A,N/A,N/A,N/A,N/A,
Ambler, AK: Ambler River,0,0,0,0,1.0,346.49,1.0,169.09,N/A,N/A,N/A,N/A,N/A,N/A,N/A,N/A,
Elizabeth Island, AK: Elizabeth Island Airport,N/A,N/A,N/A,N/A,N/A,N/A,N/A,N/A,N/A,N/A,N/A,N/A,N/A,N/A,N/A,N/A,
Saguenay, Canada: Bagotville,N/A,N/A,N/A,N/A,N/A,N/A,N/A,N/A,N/A,N/A,N/A,N/A,N/A,N/A,N/A,N/A,
Jacksonville, FL: Jacksonville International,22595.0,2914155.579999999,28432.0,3494291.980000001,27930.0,3353054.7199999974,33508.0,3596240.2,54413.0,8906672.379999997,65314.0,10821479.909999996,61996.0,9959727.730000006,62441.0,9730479.13,
La Cumbre, Argentina: La Cumbre Airport,N/A,N/A,N/A,N/A,N/A,N/A,N/A,N/A,N/A,N/A,N/A,N/A,N/A,N/A,N/A,N/A,
Weipa, Australia: Scherger,N/A,N/A,N/A,N/A,N/A,N/A,N/A,N/A,N/A,N/A,N/A,N/A,N/A,N/A,N/A,N/A,
Brady, TX: Curtis Field,N/A,N/A,N/A,N/A,N/A,N/A,N/A,N/A,N/A,N/A,N/A,N/A,N/A,N/A,N/A,N/A,
Santa Fe, Panama: Santa Fe Airport,N/A,N/A,N/A,N/A,N/A,N/A,N/A,N/A,N/A,N/A,N/A,N/A,N/A,N/A,N/A,N/A,
Hofn, Iceland: Hornafjordur,N/A,N/A,N/A,N/A,N/A,N/A,N/A,N/A,N/A,N/A,N/A,N/A,N/A,N/A,N/A,N/A,
Nevatim, Israel: Nevatim AB,N/A,N/A,N/A,N/A,N/A,N/A,N/A,N/A,N/A,N/A,N/A,N/A,N/A,N/A,N/A,N/A,
Fort de France, Martinique: Martinique Aime Cesaire,N/A,N/A,N/A,N/A,N/A,N/A,N/A,N/A,N/A,N/A,N/A,N/A,N/A,N/A,N/A,N/A,
Clay Center, KS: Clay Center Municipal,N/A,N/A,N/A,N/A,N/A,N/A,N/A,N/A,N/A,N/A,N/A,N/A,N/A,N/A,N/A,N/A,
Siassi, Papua New Guinea: Siassi Airport,N/A,N/A,N/A,N/A,N/A,N/A,N/A,N/A,N/A,N/A,N/A,N/A,N/A,N/A,N/A,N/A,
Bukhara, Uzbekistan: Bukhara Airport,N/A,N/A,N/A,N/A,N/A,N/A,N/A,N/A,N/A,N/A,N/A,N/A,N/A,N/A,N/A,N/A,
Agatti Island, India: Agatti Island Airport,N/A,N/A,N/A,N/A,N/A,N/A,N/A,N/A,N/A,N/A,N/A,N/A,N/A,N/A,N/A,N/A,
Dresden, Germany: Dresden Airport,N/A,N/A,N/A,N/A,N/A,N/A,N/A,N/A,N/A,N/A,N/A,N/A,N/A,N/A,N/A,N/A,
Islip, NY: Long Island MacArthur,8836.0,893642.2400000005,11065.0,1126301.8099999994,11836.0,1135164.1700000004,11060.0,1157457.2200000011,13832.0,987277.82,15508.0,1279305.1700000002,15708.0,1406836.93,15935.0,1371712.74,
Limon, Costa Rica: Puerto Limon,N/A,N/A,N/A,N/A,N/A,N/A,N/A,N/A,N/A,N/A,N/A,N/A,N/A,N/A,N/A,N/A,
Petersburg, AK: Petersburg James A Johnson,202.0,22024.55,312.0,35549.560000000005,366.0,45753.13,229.0,26350.340000000004,295.0,51421.28999999999,457.0,99244.43,671.0,161576.52000000002,331.0,55329.020000000004,
Valparaiso, IN: Porter County Regional,N/A,N/A,N/A,N/A,N/A,N/A,N/A,N/A,N/A,N/A,N/A,N/A,N/A,N/A,N/A,N/A,
Ho Chi Minh City, Vietnam: Tan Son Nhat International,N/A,N/A,N/A,N/A,N/A,N/A,N/A,N/A,N/A,N/A,N/A,N/A,N/A,N/A,N/A,N/A,
Wendover, UT: Wendover Airport,N/A,N/A,N/A,N/A,N/A,N/A,N/A,N/A,N/A,N/A,N/A,N/A,N/A,N/A,N/A,N/A,
Toronto, Canada: Toronto Metropolitan Area,N/A,N/A,N/A,N/A,N/A,N/A,N/A,N/A,N/A,N/A,N/A,N/A,N/A,N/A,N/A,N/A,
Livengood, AK: Livengood Airport,N/A,N/A,N/A,N/A,N/A,N/A,N/A,N/A,N/A,N/A,N/A,N/A,N/A,N/A,N/A,N/A,
Tamale, Ghana: Tamale Airport,N/A,N/A,N/A,N/A,N/A,N/A,N/A,N/A,N/A,N/A,N/A,N/A,N/A,N/A,N/A,N/A,
Katherine, Australia: Katherine Airport,N/A,N/A,N/A,N/A,N/A,N/A,N/A,N/A,N/A,N/A,N/A,N/A,N/A,N/A,N/A,N/A,
Atlantic City, NJ: Bader Field,10.0,3658.59,12.0,5238.12,N/A,N/A,292.0,43671.619999999995,N/A,N/A,N/A,N/A,N/A,N/A,N/A,N/A,
Tanacross, AK: Tanacross Airport,N/A,N/A,N/A,N/A,N/A,N/A,N/A,N/A,N/A,N/A,N/A,N/A,N/A,N/A,N/A,N/A,
Dayton, OH: James M Cox/Dayton International,18253.0,2280850.3399999994,22848.0,2612925.920000002,22464.0,2570926.439999999,21982.0,2608436.1899999967,21036.0,4148576.83,24545.0,4963499.680000001,23572.0,4599929.500000002,23125.0,4433333.359999999,
Fredericton, Canada: Fredericton International,N/A,N/A,N/A,N/A,N/A,N/A,N/A,N/A,N/A,N/A,N/A,N/A,N/A,N/A,N/A,N/A,
Detroit Lakes, MN: Detroit Lakes-Wething Field,N/A,N/A,N/A,N/A,N/A,N/A,N/A,N/A,N/A,N/A,N/A,N/A,N/A,N/A,N/A,N/A,
Deer Lodge, MT: Deer Lodge-City-County,N/A,N/A,N/A,N/A,N/A,N/A,N/A,N/A,N/A,N/A,N/A,N/A,N/A,N/A,N/A,N/A,
Split, Croatia: Split Airport,N/A,N/A,N/A,N/A,N/A,N/A,N/A,N/A,N/A,N/A,N/A,N/A,N/A,N/A,N/A,N/A,
Martinsville, VA: Blue Ridge,N/A,N/A,N/A,N/A,N/A,N/A,N/A,N/A,N/A,N/A,N/A,N/A,N/A,N/A,N/A,N/A,
Paf Warren, AK: Paf Warren Airport,N/A,N/A,N/A,N/A,N/A,N/A,N/A,N/A,N/A,N/A,N/A,N/A,N/A,N/A,N/A,N/A,
Manokotak, AK: Manokatak Seaplane Base,22.0,184.05,0,0,N/A,N/A,N/A,N/A,N/A,N/A,N/A,N/A,N/A,N/A,N/A,N/A,
Tonga Tapu, Tonga: Fua Amotu International,N/A,N/A,N/A,N/A,N/A,N/A,N/A,N/A,N/A,N/A,N/A,N/A,N/A,N/A,N/A,N/A,
Los Alamos, NM: Los Alamos Airport,N/A,N/A,1.0,440.77,3.0,1403.19,N/A,N/A,0,0,N/A,N/A,N/A,N/A,N/A,N/A,
Fallbrook, CA: Fallbrook Community Airpark,N/A,N/A,N/A,N/A,N/A,N/A,N/A,N/A,N/A,N/A,N/A,N/A,N/A,N/A,N/A,N/A,
Osage Beach, MO: Grand Glaize - Osage Beach,N/A,N/A,N/A,N/A,N/A,N/A,N/A,N/A,N/A,N/A,N/A,N/A,N/A,N/A,N/A,N/A,
McArthur River, Australia: McArthur River Mine,N/A,N/A,N/A,N/A,N/A,N/A,N/A,N/A,N/A,N/A,N/A,N/A,N/A,N/A,N/A,N/A,
Alamogordo, NM: Holloman AFB,N/A,N/A,N/A,N/A,N/A,N/A,N/A,N/A,N/A,N/A,N/A,N/A,N/A,N/A,N/A,N/A,
Sudbury, Canada: Sudbury Airport,N/A,N/A,N/A,N/A,N/A,N/A,N/A,N/A,N/A,N/A,N/A,N/A,N/A,N/A,N/A,N/A,
Princeton, NJ: Princeton Airport,N/A,N/A,N/A,N/A,N/A,N/A,N/A,N/A,N/A,N/A,N/A,N/A,N/A,N/A,N/A,N/A,
Eight Fathom Bight, AK: Eight Fathom Bight Airport,N/A,N/A,N/A,N/A,N/A,N/A,N/A,N/A,N/A,N/A,N/A,N/A,N/A,N/A,N/A,N/A,
Caen, France: Caen Carpiquet,N/A,N/A,N/A,N/A,N/A,N/A,N/A,N/A,N/A,N/A,N/A,N/A,N/A,N/A,N/A,N/A,
Oceano, CA: Oceano County,N/A,N/A,N/A,N/A,N/A,N/A,N/A,N/A,N/A,N/A,N/A,N/A,N/A,N/A,N/A,N/A,
Athens, OH: Ohio University,N/A,N/A,N/A,N/A,N/A,N/A,N/A,N/A,N/A,N/A,N/A,N/A,N/A,N/A,N/A,N/A,
Ushuaia, Argentina: Islas Malvinas,N/A,N/A,N/A,N/A,N/A,N/A,N/A,N/A,N/A,N/A,N/A,N/A,N/A,N/A,N/A,N/A,
Mersing, Malaysia: Mersing Malay.,N/A,N/A,N/A,N/A,N/A,N/A,N/A,N/A,N/A,N/A,N/A,N/A,N/A,N/A,N/A,N/A,
Cartago, Colombia: Cartago Airport,N/A,N/A,N/A,N/A,N/A,N/A,N/A,N/A,N/A,N/A,N/A,N/A,N/A,N/A,N/A,N/A,
Sandpoint, AK: Sand Point,73.0,12806.76,88.0,14363.059999999998,84.0,13057.26,65.0,10814.259999999998,18.0,7208.04,48.0,12750.54,29.0,15552.470000000001,38.0,7660.200000000001,
Quincy, WA: Quincy Municipal,N/A,N/A,N/A,N/A,N/A,N/A,N/A,N/A,N/A,N/A,N/A,N/A,N/A,N/A,N/A,N/A,
Piura, Peru: Capitan FAP Guillermo Concha Iberico,N/A,N/A,N/A,N/A,N/A,N/A,N/A,N/A,N/A,N/A,N/A,N/A,N/A,N/A,N/A,N/A,
St. Etienne, France: Saint Etienne Loire,N/A,N/A,N/A,N/A,N/A,N/A,N/A,N/A,N/A,N/A,N/A,N/A,N/A,N/A,N/A,N/A,
Alliance, NE: Alliance Municipal,5.0,1995.71,11.0,4796.33,6.0,2189.66,6.0,2096.99,5.0,2390.21,2.0,621.0,N/A,N/A,N/A,N/A,
Altai, Mongolia: Altai Airport,N/A,N/A,N/A,N/A,N/A,N/A,N/A,N/A,N/A,N/A,N/A,N/A,N/A,N/A,N/A,N/A,
Annapolis, MD: Lee,N/A,N/A,N/A,N/A,N/A,N/A,N/A,N/A,N/A,N/A,N/A,N/A,N/A,N/A,N/A,N/A,
Barcelonnette, France: Barcelonnette Airport,N/A,N/A,N/A,N/A,N/A,N/A,N/A,N/A,N/A,N/A,N/A,N/A,N/A,N/A,N/A,N/A,
Russellville, KY: Russellville-Logan County,N/A,N/A,N/A,N/A,N/A,N/A,N/A,N/A,N/A,N/A,N/A,N/A,N/A,N/A,N/A,N/A,
Selawik, AK: Roland Norton Memorial,N/A,N/A,N/A,N/A,N/A,N/A,N/A,N/A,N/A,N/A,N/A,N/A,N/A,N/A,N/A,N/A,
Oslo, Norway: Gardermoen,N/A,N/A,N/A,N/A,N/A,N/A,N/A,N/A,N/A,N/A,N/A,N/A,N/A,N/A,N/A,N/A,N/A,N/A,N/A,N/A,N/A,N/A,N/A,N/A,N/A,N/A,N/A,N/A,N/A,N/A,N/A,N/A,
Durango, CO: Animas Air Park,N/A,N/A,N/A,N/A,N/A,N/A,N/A,N/A,N/A,N/A,N/A,N/A,N/A,N/A,N/A,N/A,
Bryce Canyon, UT: Bryce Canyon Airport,N/A,N/A,N/A,N/A,N/A,N/A,N/A,N/A,N/A,N/A,N/A,N/A,N/A,N/A,N/A,N/A,
Baltimore, MD: Martin State,N/A,N/A,N/A,N/A,N/A,N/A,N/A,N/A,N/A,N/A,N/A,N/A,N/A,N/A,N/A,N/A,
Saginaw Bay, AK: Saginaw,N/A,N/A,N/A,N/A,N/A,N/A,N/A,N/A,N/A,N/A,N/A,N/A,N/A,N/A,N/A,N/A,
Liping City, China: Liping,N/A,N/A,N/A,N/A,N/A,N/A,N/A,N/A,N/A,N/A,N/A,N/A,N/A,N/A,N/A,N/A,
Port Bailey, AK: Port Bailey Airport,1.0,50.0,N/A,N/A,0,0,N/A,N/A,N/A,N/A,N/A,N/A,N/A,N/A,N/A,N/A,
Covington, TN: Covington Municipal,N/A,N/A,N/A,N/A,N/A,N/A,N/A,N/A,N/A,N/A,N/A,N/A,N/A,N/A,N/A,N/A,
Leipzig, Germany: Leipzig Halle,N/A,N/A,N/A,N/A,N/A,N/A,N/A,N/A,N/A,N/A,N/A,N/A,N/A,N/A,N/A,N/A,
Saratov, Russia: Engels AFB,N/A,N/A,N/A,N/A,N/A,N/A,N/A,N/A,N/A,N/A,N/A,N/A,N/A,N/A,N/A,N/A,
Kirkuk, Iraq: Kirkuk Airport,N/A,N/A,N/A,N/A,N/A,N/A,N/A,N/A,N/A,N/A,N/A,N/A,N/A,N/A,N/A,N/A,
Nairobi, Kenya: Nairobi Jomo Kenyatta International,N/A,N/A,N/A,N/A,N/A,N/A,N/A,N/A,N/A,N/A,N/A,N/A,N/A,N/A,N/A,N/A,
Moscow, Russia: Domodedovo,N/A,N/A,N/A,N/A,N/A,N/A,N/A,N/A,N/A,N/A,N/A,N/A,N/A,N/A,N/A,N/A,
Kokkola/Pietarsaari, Finland: Kokkola Pietarsaari,N/A,N/A,N/A,N/A,N/A,N/A,N/A,N/A,N/A,N/A,N/A,N/A,N/A,N/A,N/A,N/A,
Huanuco, Peru: Alferez FAP David Figueroa Fernandini,N/A,N/A,N/A,N/A,N/A,N/A,N/A,N/A,N/A,N/A,N/A,N/A,N/A,N/A,N/A,N/A,
Seneca, NY: Seneca AAF,N/A,N/A,N/A,N/A,N/A,N/A,N/A,N/A,N/A,N/A,N/A,N/A,N/A,N/A,N/A,N/A,
